LineId,Time,Level,Content,EventId,EventTemplate,System,VariableTemplate,OID,LOI,OBN,TID,SID,TDA,CRS,OBA,STC,OTP
1550,Mon Dec 05 11:06:52 2005,error,jk2_init() Can't find child 5622 in scoreboard,Apache_E5,jk2_init() Can't find child <*> in scoreboard,Apache,O O O O O O O O O OID O O O OID,2,0,0,0,0,0,0,0,0,0
1552,Mon Dec 05 11:06:52 2005,error,mod_jk child init 1 -2,Apache_E6,mod_jk child init <*> <*>,Apache,O O O O O O O O LOI,0,1,0,0,0,0,0,0,0,0
1994,Mon Dec 05 19:14:09 2005,error,[client 61.220.139.68] Directory index forbidden by rule: /var/www/html/,Apache_E4,[client <*>] Directory index forbidden by rule: <*>,Apache,O O O O O O O O O O O O STC,0,0,0,0,0,0,0,0,1,0
1998,Mon Dec 05 19:15:55 2005,notice,jk2_init() Found child 6790 in scoreboard slot 7,Apache_E1,jk2_init() Found child <*> in scoreboard slot <*>,Apache,O O O O O O O O O O O O STC,0,0,0,0,0,0,0,0,1,0
1999,Mon Dec 05 19:15:57 2005,notice,workerEnv.init() ok /etc/httpd/conf/workers2.properties,Apache_E2,workerEnv.init() ok <*>,Apache,O O O O O O O O O OID O O O OID,2,0,0,0,0,0,0,0,0,0
2000,Mon Dec 05 19:15:57 2005,error,mod_jk child workerEnv in error state 6,Apache_E3,mod_jk child workerEnv in error state <*>,Apache,O O O O O O O O O OID O O O OID,2,0,0,0,0,0,0,0,0,0
