LineId,Month,Date,Time,User,Component,PID,Address,Content,EventId,EventTemplate,System,VariableTemplate,OID,LOI,OBN,TID,SID,TDA,CRS,OBA,STC,OTP
1,Jul,1,09:00:55,calvisitor-10-105-160-95,kernel,0,,IOThunderboltSwitch<0>(0x0)::listenerCallback - Thunderbolt HPD packet for route = 0x0 port = 11 unplug = 0,Mac_E252,<*>(<*>)::listenerCallback - Thunderbolt HPD packet for route = <*> port = <*> unplug = <*>,Mac,O O O O O O O O STC O O O STC,0,0,0,0,0,0,0,0,2,0
2,Jul,1,09:01:05,calvisitor-10-105-160-95,com.apple.CDScheduler,43,,Thermal pressure state: 1 Memory pressure state: 0,Mac_E323,Thermal pressure state: <*> Memory pressure state: <*>,Mac,O O O O O O OID O O O OBA O OBA O OBA,1,0,0,0,0,0,0,3,0,0
3,Jul,1,09:01:06,calvisitor-10-105-160-95,QQ,10018,,FA||Url||taskID[2019352994] dealloc,Mac_E216,FA||Url||taskID[<*>] dealloc,Mac,O O O O O LOI O O O O LOI O O O O O O,0,2,0,0,0,0,0,0,0,0
4,Jul,1,09:02:26,calvisitor-10-105-160-95,kernel,0,,ARPT: 620701.011328: AirPort_Brcm43xx::syncPowerState: WWEN[enabled],Mac_E128,ARPT: <*>: <*>::syncPowerState: WWEN[enabled],Mac,O O O O O O OBA LOI O OBA,0,1,0,0,0,0,0,2,0,0
5,Jul,1,09:02:26,authorMacBook-Pro,kernel,0,,ARPT: 620702.879952: AirPort_Brcm43xx::platformWoWEnable: WWEN[disable],Mac_E124,ARPT: <*>: <*>::platformWoWEnable: WWEN[disable],Mac,O O O O O O O O LOI O LOI O LOI,0,3,0,0,0,0,0,0,0,0
6,Jul,1,09:03:11,calvisitor-10-105-160-95,mDNSResponder,91,,mDNS_DeregisterInterface: Frequent transitions for interface awdl0 (FE80:0000:0000:0000:D8A5:90FF:FEF5:7FFF),Mac_E260,mDNS_DeregisterInterface: Frequent transitions for interface awdl0 (<*>),Mac,O O O O O O O O O O OID O O STC,1,0,0,0,0,0,0,0,1,0
7,Jul,1,09:03:13,calvisitor-10-105-160-95,kernel,0,,"ARPT: 620749.901374: IOPMPowerSource Information: onSleep,  SleepType: Normal Sleep,  'ExternalConnected': Yes, 'TimeRemaining': 0,",Mac_E135,"ARPT: <*>: IOPMPowerSource Information: onSleep, SleepType: Normal Sleep, 'ExternalConnected': Yes, 'TimeRemaining': <*>,",Mac,O O O O O O O O O O O STC O O O O,0,0,0,0,0,0,0,0,1,0
8,Jul,1,09:04:33,calvisitor-10-105-160-95,kernel,0,,"ARPT: 620750.434035: wl0: wl_update_tcpkeep_seq: Original Seq: 3226706533, Ack: 3871687177, Win size: 4096",Mac_E149,"ARPT: <*>: wl0: wl_update_tcpkeep_seq: Original Seq: <*>, Ack: <*>, Win size: <*>",Mac,O O O O O O OID O O OBA O O OBA O O,1,0,0,0,0,0,0,2,0,0
9,Jul,1,09:04:33,authorMacBook-Pro,kernel,0,,ARPT: 620752.337198: ARPT: Wake Reason: Wake on Scan offload,Mac_E131,ARPT: <*>: ARPT: Wake Reason: Wake on Scan offload,Mac,O O O O O O LOI O O O O O O O O O O O O O O TDA O,0,1,0,0,0,1,0,0,0,0
10,Jul,1,09:04:37,authorMacBook-Pro,symptomsd,215,,__73-[NetworkAnalyticsEngine observeValueForKeyPath:ofObject:change:context:]_block_invoke unexpected switch value 2,Mac_E50,<*>-[NetworkAnalyticsEngine observeValueForKeyPath:ofObject:change:context:]_block_invoke unexpected switch value <*>,Mac,O O O O O O O O O O O LOI O O LOI,0,2,0,0,0,0,0,0,0,0
11,Jul,1,09:12:20,authorMacBook-Pro,kernel,0,,IO80211AWDLPeerManager::setAwdlAutoMode Resuming AWDL,Mac_E58,<*>::setAwdlAutoMode Resuming AWDL,Mac,O O O O O O O O O LOI,0,1,0,0,0,0,0,0,0,0
13,Jul,1,09:18:16,calvisitor-10-105-160-95,kernel,0,,"ARPT: 620896.311264: wl0: MDNS: 0 SRV Recs, 0 TXT Recs",Mac_E140,"ARPT: <*>: wl0: MDNS: <*> SRV Recs, <*> TXT Recs",Mac,O O O O O O O O O O O O,0,0,0,0,0,0,0,0,0,0
14,Jul,1,09:19:03,calvisitor-10-105-160-95,kernel,0,,AppleCamIn::systemWakeCall - messageType = 0xE0000340,Mac_E120,AppleCamIn::systemWakeCall - messageType = <*>,Mac,O O O O O O O O O O OID SID,1,0,0,0,1,0,0,0,0,0
15,Jul,1,09:19:03,authorMacBook-Pro,configd,53,,"setting hostname to ""authorMacBook-Pro.local""",Mac_E311,"setting hostname to ""<*>""",Mac,O O O O O O LOI O O O O O O O O O O O O O O TDA O,0,1,0,0,0,1,0,0,0,0
16,Jul,1,09:19:13,calvisitor-10-105-160-95,com.apple.cts,258,,"com.apple.icloud.fmfd.heartbeat: scheduler_evaluate_activity told me to run this job; however, but the start time isn't for 439034 seconds.  Ignoring.",Mac_E189,"com.apple.<*>: scheduler_evaluate_activity told me to run this job; however, but the start time isn't for <*> seconds. Ignoring.",Mac,O O O O O O LOI O O O O O O O O O O O O O O TDA O,0,1,0,0,0,1,0,0,0,0
17,Jul,1,09:21:57,authorMacBook-Pro,corecaptured,31174,,CCIOReporterFormatter::addRegistryChildToChannelDictionary streams 7,Mac_E175,CCIOReporterFormatter::addRegistryChildToChannelDictionary streams <*>,Mac,O O O O O O LOI O O O O O O O O O O O O O O TDA O,0,1,0,0,0,1,0,0,0,0
18,Jul,1,09:21:58,calvisitor-10-105-160-95,com.apple.WebKit.WebContent,25654,,[09:21:58.929] <<<< CRABS >>>> crabsFlumeHostAvailable: [0x7f961cf08cf0] Byte flume reports host available again.,Mac_E13,[<*>:<*>:<*>] <<<< CRABS >>>> crabsFlumeHostAvailable: [<*>] Byte flume reports host available again.,Mac,O O O O O LOI O O STC O O O O LOI O LOI,0,3,0,0,0,0,0,0,1,0
21,Jul,1,09:23:26,calvisitor-10-105-160-95,kernel,0,,AirPort: Link Down on awdl0. Reason 1 (Unspecified).,Mac_E109,AirPort: Link Down on awdl0. Reason <*> (Unspecified).,Mac,O O O O O O O O STC O O O STC,0,0,0,0,0,0,0,0,2,0
23,Jul,1,09:24:13,calvisitor-10-105-160-95,kernel,0,,"PM response took 2010 ms (54, powerd)",Mac_E288,"PM response took <*> ms (<*>, powerd)",Mac,O O O O O O O O O O TDA O,0,0,0,0,0,1,0,0,0,0
25,Jul,1,09:25:45,calvisitor-10-105-160-95,kernel,0,,"ARPT: 621131.293163: wl0: Roamed or switched channel, reason #8, bssid 5c:50:15:4c:18:13, last RSSI -64",Mac_E143,"ARPT: <*>: wl0: Roamed or switched channel, reason #<*>, bssid <*>:<*>:<*>:<*>, last RSSI <*>",Mac,O O O O O O O O O O O O O,0,0,0,0,0,0,0,0,0,0
28,Jul,1,09:26:43,calvisitor-10-105-160-95,networkd,195,,nw_nat64_post_new_ifstate successfully changed NAT64 ifstate from 0x4 to 0x8000000000000000,Mac_E276,<*> successfully changed NAT64 ifstate from <*> to <*>,Mac,O O O O O O O O O O O OBA,0,0,0,0,0,0,0,1,0,0
31,Jul,1,09:27:06,calvisitor-10-105-160-95,kernel,0,,"IO80211AWDLPeerManager::setAwdlSuspendedMode() Suspending AWDL, enterQuietMode(true)",Mac_E61,"<*>::setAwdlSuspendedMode() Suspending AWDL, enterQuietMode(<*>)",Mac,O O O O O O,0,0,0,0,0,0,0,0,0,0
32,Jul,1,09:28:41,authorMacBook-Pro,netbiosd,31198,,"network_reachability_changed : network is not reachable, netbiosd is shutting down",Mac_E272,"network_reachability_changed : network is not reachable, netbiosd is shutting down",Mac,O O O O O O OID O O OBA O O OBA O O,1,0,0,0,0,0,0,2,0,0
33,Jul,1,09:28:41,authorMacBook-Pro,corecaptured,31206,,CCFile::captureLogRun() Exiting CCFile::captureLogRun,Mac_E173,CCFile::captureLogRun() Exiting CCFile::captureLogRun,Mac,O O O O O O OID O O O O O O O O O TDA,1,0,0,0,0,1,0,0,0,0
36,Jul,1,09:29:02,calvisitor-10-105-160-95,sandboxd,129,[31211],com.apple.Addres(31211) deny network-outbound /private/var/run/mDNSResponder,Mac_E52,<*>(<*>) deny network-outbound <*>,Mac,O O O O O O STC O O STC O O O O O O O O O O O O O O,0,0,0,0,0,0,0,0,2,0
38,Jul,1,09:29:25,calvisitor-10-105-160-95,kernel,0,,ARPT: 621241.634070: wl0: MDNS: IPV6 Addr: 2607:f140:6000:8:c6b3:1ff:fecd:467f,Mac_E142,ARPT: <*>: wl0: MDNS: IPV6 Addr: <*>,Mac,O O O O O OID O,1,0,0,0,0,0,0,0,0,0
39,Jul,1,09:31:48,authorMacBook-Pro,kernel,0,,AirPort: Link Up on en0,Mac_E112,AirPort: Link Up on en0,Mac,O O O O O O O OID O O O O O O O O O O O,1,0,0,0,0,0,0,0,0,0
42,Jul,1,09:32:13,calvisitor-10-105-160-95,kernel,0,,Sandbox: com.apple.Addres(31229) deny(1) network-outbound /private/var/run/mDNSResponder,Mac_E300,Sandbox: <*>(<*>) deny(<*>) network-outbound <*>,Mac,O O O O O O O O O O O STC O,0,0,0,0,0,0,0,0,1,0
44,Jul,1,09:33:13,calvisitor-10-105-160-95,kernel,0,,ARPT: 621342.242614: AirPort_Brcm43xx::platformWoWEnable: WWEN[enable],Mac_E125,ARPT: <*>: <*>::platformWoWEnable: WWEN[enable],Mac,O O O O O O OID O O O O LOI O O LOI,1,2,0,0,0,0,0,0,0,0
45,Jul,1,09:33:13,calvisitor-10-105-160-95,kernel,0,,AirPort: Link Up on awdl0,Mac_E111,AirPort: Link Up on awdl0,Mac,O O O O O OID O,1,0,0,0,0,0,0,0,0,0
48,Jul,1,09:34:42,calvisitor-10-105-160-95,kernel,0,,AppleThunderboltGenericHAL::earlyWake - complete - took 0 milliseconds,Mac_E122,AppleThunderboltGenericHAL::earlyWake - complete - took <*> milliseconds,Mac,O O O O O O O O O O O O O O O O O O O O O O O O O O O O O O O O O O O O O O O O O O O O O O O O O O O O O O O O O O O O O O O O O O O O O O,0,0,0,0,0,0,0,0,0,0
50,Jul,1,09:35:27,calvisitor-10-105-160-95,mDNSResponder,91,,mDNS_DeregisterInterface: Frequent transitions for interface en0 (2607:F140:6000:0008:C6B3:01FF:FECD:467F),Mac_E261,mDNS_DeregisterInterface: Frequent transitions for interface en0 (<*>),Mac,O O O O O O O O O O O OBN OID LOI,1,1,1,0,0,0,0,0,0,0
51,Jul,1,09:36:19,calvisitor-10-105-160-95,kernel,0,,AppleThunderboltNHIType2::waitForOk2Go2Sx - retries = 7,Mac_E55,<*>::<*> - retries = <*>,Mac,O O O O O O O O O O O O O O OID,1,0,0,0,0,0,0,0,0,0
52,Jul,1,09:39:57,calvisitor-10-105-160-95,kernel,0,,"ARPT: 621490.858770: wl0: wl_update_tcpkeep_seq: Updated seq/ack/win from UserClient Seq 2119064372, Ack 3325040593, Win size 278",Mac_E150,"ARPT: <*>: wl0: wl_update_tcpkeep_seq: Updated seq/ack/win from UserClient Seq <*>, Ack <*>, Win size <*>",Mac,O O O O O O O O O O,0,0,0,0,0,0,0,0,0,0
56,Jul,1,09:41:34,calvisitor-10-105-160-95,kernel,0,,en0::IO80211Interface::postMessage bssid changed,Mac_E56,<*>::<*>::postMessage bssid changed,Mac,O O O O O OID O O O O O O O O O,1,0,0,0,0,0,0,0,0,0
64,Jul,1,09:42:23,calvisitor-10-105-160-95,kernel,0,,AppleThunderboltNHIType2::waitForOk2Go2Sx - intel_rp = 1 dlla_reporting_supported = 0,Mac_E54,<*>::<*> - intel_rp = <*> dlla_reporting_supported = <*>,Mac,O O O O O O O O O O O OBA,0,0,0,0,0,0,0,1,0,0
66,Jul,1,09:43:22,calvisitor-10-105-160-95,mDNSResponder,91,,mDNS_RegisterInterface: Frequent transitions for interface en0 (FE80:0000:0000:0000:C6B3:01FF:FECD:467F),Mac_E263,mDNS_RegisterInterface: Frequent transitions for interface en0 (<*>),Mac,O O O O O O O O O LOI,0,1,0,0,0,0,0,0,0,0
67,Jul,1,09:44:23,authorMacBook-Pro,kernel,0,,AppleCamIn::wakeEventHandlerThread,Mac_E121,AppleCamIn::wakeEventHandlerThread,Mac,O O O O O O,0,0,0,0,0,0,0,0,0,0
70,Jul,1,09:45:08,calvisitor-10-105-160-95,kernel,0,,"ARPT: 621686.164365: wl0: setup_keepalive: Local port: 62614, Remote port: 443",Mac_E146,"ARPT: <*>: wl0: setup_keepalive: Local port: <*>, Remote port: <*>",Mac,O O O O O O O O O O O OBA,0,0,0,0,0,0,0,1,0,0
74,Jul,1,10:08:20,calvisitor-10-105-160-95,Dock,307,,-[UABestAppSuggestionManager notifyBestAppChanged:type:options:bundleIdentifier:activityType:dynamicIdentifier:when:confidence:deviceName:deviceIdentifier:deviceType:] (null) UASuggestedActionType=0 (null)/(null) opts=(null) when=2017-07-01 17:08:20 +0000 confidence=1 from=(null)/(null) (UABestAppSuggestionManager.m #319),Mac_E48,-[UABestAppSuggestionManager notifyBestAppChanged:type:options:bundleIdentifier:activityType:dynamicIdentifier:when:confidence:deviceName:deviceIdentifier:deviceType:] (<*>) UASuggestedActionType=<*> (<*>)/(<*>) opts=(<*>) when=<*>,Mac,O O O O O O O O O O O O O O O O TID,0,0,0,1,0,0,0,0,0,0
75,Jul,1,10:08:20,calvisitor-10-105-160-95,kernel,0,,en0: channel changed to 1,Mac_E208,en0: channel changed to <*>,Mac,O O O O O OID O O O O O O O O O,1,0,0,0,0,0,0,0,0,0
76,Jul,1,10:08:20,authorMacBook-Pro,kernel,0,,ARPT: 621799.252673: AQM agg results 0x8001 len hi/lo: 0x0 0x26 BAbitmap(0-3) 0 0 0 0,Mac_E130,ARPT: <*>: AQM agg results <*> len hi/lo: <*> <*> BAbitmap(<*>-<*>) <*>,Mac,O O O O O O OID OID O O,2,0,0,0,0,0,0,0,0,0
77,Jul,1,10:08:21,authorMacBook-Pro,corecaptured,31313,,"CCFile::captureLog Received Capture notice id: 1498928900.759059, reason = AuthFail:sts:5_rsn:0",Mac_E171,"CCFile::captureLog Received Capture notice id: <*>, reason = AuthFail:sts:<NUM>_rsn:<NUM>",Mac,O O O O O O O O,0,0,0,0,0,0,0,0,0,0
79,Jul,1,10:08:49,calvisitor-10-105-160-95,kernel,0,,IO80211AWDLPeerManager::setAwdlOperatingMode Setting the AWDL operation mode from AUTO to SUSPENDED,Mac_E59,<*>::setAwdlOperatingMode Setting the AWDL operation mode from AUTO to SUSPENDED,Mac,O O O O O O O O,0,0,0,0,0,0,0,0,0,0
80,Jul,1,10:08:55,calvisitor-10-105-160-95,AddressBookSourceSync,31318,,Unrecognized attribute value: t:AbchPersonItemType,Mac_E328,Unrecognized attribute value: t:AbchPersonItemType,Mac,O O O O O O O O O O,0,0,0,0,0,0,0,0,0,0
84,Jul,1,10:13:39,calvisitor-10-105-160-95,secd,276,,"SOSAccountThisDeviceCanSyncWithCircle sync with device failure: Error Domain=com.apple.security.sos.error Code=1035 ""Account identity not set"" UserInfo={NSDescription=Account identity not set}",Mac_E313,"SOSAccountThisDeviceCanSyncWithCircle sync with device failure: Error Domain=com.apple.security.sos.error Code=<*> ""Account identity not set"" UserInfo={NSDescription=Account identity not set}",Mac,O O O O O O,0,0,0,0,0,0,0,0,0,0
85,Jul,1,10:13:43,calvisitor-10-105-160-95,SpotlightNetHelper,352,,"CFPasteboardRef CFPasteboardCreate(CFAllocatorRef, CFStringRef) : failed to create global data",Mac_E183,"CFPasteboardRef CFPasteboardCreate(CFAllocatorRef, CFStringRef) : failed to create global data",Mac,O O O O O LOI O STC O O O TDA O O OBA,0,1,0,0,0,1,0,1,1,0
89,Jul,1,10:46:47,calvisitor-10-105-160-95,sharingd,30299,,10:46:47.425 : BTLE scanner Powered On,Mac_E64,<*>:<*>:<*> : BTLE scanner Powered On,Mac,O O O O O O O O O O SID,0,0,0,0,1,0,0,0,0,0
90,Jul,1,10:46:48,calvisitor-10-105-160-95,QQ,10018,,button report: 0x8002be0,Mac_E161,button report: <*>,Mac,O O O O O O,0,0,0,0,0,0,0,0,0,0
92,Jul,1,11:20:51,calvisitor-10-105-160-95,sharingd,30299,,11:20:51.293 : BTLE discovered device with hash <01faa200 00000000 0000>,Mac_E62,<*>:<*>:<*> : BTLE discovered device with hash <*> <*> <*>,Mac,O O O O O O O O O O O OBA,0,0,0,0,0,0,0,1,0,0
93,Jul,1,11:24:45,calvisitor-10-105-160-95,secd,276,,"securityd_xpc_dictionary_handler cloudd[326] copy_matching Error Domain=NSOSStatusErrorDomain Code=-50 ""query missing class name"" (paramErr: error in user parameter list) UserInfo={NSDescription=query missing class name}",Mac_E304,"securityd_xpc_dictionary_handler cloudd[<*>] copy_matching Error Domain=NSOSStatusErrorDomain Code=<*> ""query missing class name"" (paramErr: error in user parameter list) UserInfo={NSDescription=query missing class name}",Mac,O O O O O O,0,0,0,0,0,0,0,0,0,0
94,Jul,1,11:29:32,calvisitor-10-105-160-95,locationd,82,,Location icon should now be in state 'Inactive',Mac_E259,Location icon should now be in state 'Inactive',Mac,O O O O O O O O STC O O O STC,0,0,0,0,0,0,0,0,2,0
95,Jul,1,11:38:18,calvisitor-10-105-160-95,kernel,0,,"ARPT: 626126.086205: wl0: setup_keepalive: interval 900, retry_interval 30, retry_count 10",Mac_E144,"ARPT: <*>: wl0: setup_keepalive: interval <*>, retry_interval <*>, retry_count <*>",Mac,O O O O O O O O,0,0,0,0,0,0,0,0,0,0
96,Jul,1,11:38:18,calvisitor-10-105-160-95,kernel,0,,ARPT: 626126.086246: wl0: MDNS: IPV4 Addr: 10.105.160.95,Mac_E141,ARPT: <*>: wl0: MDNS: IPV4 Addr: <*>,Mac,O O O O O O OID O O O O LOI,1,1,0,0,0,0,0,0,0,0
100,Jul,1,11:39:48,calvisitor-10-105-160-95,networkd,195,,__42-[NETClientConnection evaluateCrazyIvan46]_block_invoke CI46 - Hit by torpedo! QQ.10018 tc19060 125.39.133.143:14000,Mac_E49,<*>-[NETClientConnection <*>]_block_invoke CI46 - Hit by torpedo! <*> <*> <*>:<*>,Mac,O O O O O LOI O O O OBA,0,1,0,0,0,0,0,1,0,0
102,Jul,1,11:41:26,authorMacBook-Pro,kernel,0,,"Setting BTCoex Config: enable_2G:1, profile_2g:0, enable_5G:1, profile_5G:0",Mac_E310,"Setting BTCoex Config: <*>:<*>, <*>:<*>, <*>:<*>, <*>:<*>",Mac,O O O O O O O O O LOI OID STC STC O O O,1,1,0,0,0,0,0,0,2,0
105,Jul,1,11:43:08,authorMacBook-Pro,UserEventAgent,43,,Captive: [CNInfoNetworkActive:1748] en0: SSID 'CalVisitor' making interface primary (cache indicates network not captive),Mac_E162,Captive: [CNInfoNetworkActive:<*>] en0: SSID 'CalVisitor' making interface primary (cache indicates network not captive),Mac,O O O O O O O O O O O O O LOI O O LOI O O SID,0,2,0,0,1,0,0,0,0,0
109,Jul,1,11:44:26,authorMacBook-Pro,kernel,0,,IO80211AWDLPeerManager::setAwdlOperatingMode Setting the AWDL operation mode from SUSPENDED to AUTO,Mac_E60,<*>::setAwdlOperatingMode Setting the AWDL operation mode from SUSPENDED to AUTO,Mac,O O O O O O O O,0,0,0,0,0,0,0,0,0,0
110,Jul,1,11:46:16,calvisitor-10-105-160-95,symptomsd,215,,-[NetworkAnalyticsEngine _writeJournalRecord:fromCellFingerprint:key:atLOI:ofKind:lqm:isFaulty:] Hashing of the primary key failed. Dropping the journal record.,Mac_E44,-[NetworkAnalyticsEngine _writeJournalRecord:fromCellFingerprint:key:atLOI:ofKind:lqm:isFaulty:] Hashing of the primary key failed. Dropping the journal record.,Mac,O O O O O O O O O TID,0,0,0,1,0,0,0,0,0,0
112,Jul,1,11:46:19,authorMacBook-Pro,sharingd,30299,,11:46:19.229 : Finished generating hashes,Mac_E68,<*>:<*>:<*> : Finished generating hashes,Mac,O O O O O OID O O O O O O TDA O,1,0,0,0,0,1,0,0,0,0
113,Jul,1,11:46:21,authorMacBook-Pro,UserEventAgent,43,,Captive: CNPluginHandler en0: Evaluating,Mac_E164,Captive: CNPluginHandler en0: Evaluating,Mac,O O O O O OID O O O O OBA,1,0,0,0,0,0,0,1,0,0
119,Jul,1,11:49:29,calvisitor-10-105-160-95,QQ,10018,,tcp_connection_destination_perform_socket_connect 19110 connectx to 183.57.48.75:80@0 failed: [50] Network is down,Mac_E316,tcp_connection_destination_perform_socket_connect <*> connectx to <*>:<*>@<*> failed: [<*>] Network is down,Mac,O O O O O O O O O O O LOI,0,1,0,0,0,0,0,0,0,0
120,Jul,1,11:49:29,calvisitor-10-105-160-95,kernel,0,,AirPort: Link Down on en0. Reason 8 (Disassociated because station leaving).,Mac_E110,AirPort: Link Down on en0. Reason <*> (Disassociated because station leaving).,Mac,O O O O O O O O STC,0,0,0,0,0,0,0,0,1,0
122,Jul,1,11:49:29,authorMacBook-Pro,kernel,0,,"USBMSC Identifier (non-unique): 000000000820 0x5ac 0x8406 0x820, 3",Mac_E331,USBMSC Identifier (non-unique): <*>,Mac,O O O O O LOI O O O O LOI O O O O O O O O O O O O O O,0,2,0,0,0,0,0,0,0,0
124,Jul,1,11:49:30,authorMacBook-Pro,corecaptured,31480,,CCXPCService::setStreamEventHandler Registered for notification callback.,Mac_E180,CCXPCService::setStreamEventHandler Registered for notification callback.,Mac,O O O O O OID OID O O O,2,0,0,0,0,0,0,0,0,0
125,Jul,1,11:49:30,authorMacBook-Pro,Dropbox,24019,,[0701/114930:WARNING:dns_config_service_posix.cc(306)] Failed to read DnsConfig.,Mac_E10,[<*>/<*>:WARNING:dns_config_service_posix.cc(<*>)] Failed to read DnsConfig.,Mac,O O O O O O O O O O O O,0,0,0,0,0,0,0,0,0,0
126,Jul,1,11:49:35,calvisitor-10-105-160-95,cdpd,11807,,Saw change in network reachability (isReachable=2),Mac_E301,Saw change in network reachability (isReachable=<*>),Mac,O O O O O O O,0,0,0,0,0,0,0,0,0,0
127,Jul,1,11:51:02,authorMacBook-Pro,kernel,0,,[HID] [ATC] AppleDeviceManagementHIDEventService::processWakeReason Wake reason: Host (0x01),Mac_E33,[HID] [ATC] AppleDeviceManagementHIDEventService::processWakeReason Wake reason: Host (<*>),Mac,O O O O O LOI O O STC O O O O LOI O LOI,0,3,0,0,0,0,0,0,1,0
128,Jul,1,11:51:07,authorMacBook-Pro,kernel,0,,en0: BSSID changed to 5c:50:15:36:bc:03,Mac_E207,en0: BSSID changed to <*>,Mac,O O O O O O O O O LOI,0,1,0,0,0,0,0,0,0,0
132,Jul,1,11:51:25,calvisitor-10-105-160-95,com.apple.AddressBook.InternetAccountsBridge,31496,,dnssd_clientstub ConnectToServer: connect()-> No of tries: 1,Mac_E203,dnssd_clientstub ConnectToServer: connect()-> No of tries: <*>,Mac,O O O O O O O O,0,0,0,0,0,0,0,0,0,0
135,Jul,1,11:53:49,authorMacBook-Pro,networkd,195,,-[NETClientConnection effectiveBundleID] using process name apsd as bundle ID (this is expected for daemons without bundle ID,Mac_E41,-[NETClientConnection effectiveBundleID] using process name apsd as bundle ID (this is expected for daemons without bundle ID,Mac,O O O O O O OID OID O O,2,0,0,0,0,0,0,0,0,0
147,Jul,1,12:52:57,calvisitor-10-105-160-95,kernel,0,,"RTC: Maintenance 2017/7/1 19:52:56, sleep 2017/7/1 19:40:18",Mac_E295,"RTC: Maintenance <*>/<*>/<*> <*>:<*>:<*>, sleep <*>/<*>/<*> <*>:<*>:<*>",Mac,O O O O O O O O O O O O O O O,0,0,0,0,0,0,0,0,0,0
157,Jul,1,13:41:48,calvisitor-10-105-160-95,kernel,0,,RTC: PowerByCalendarDate setting ignored,Mac_E296,RTC: PowerByCalendarDate setting ignored,Mac,O O O O O O O STC,0,0,0,0,0,0,0,0,1,0
159,Jul,1,13:42:01,calvisitor-10-105-160-95,locationd,82,,Location icon should now be in state 'Active',Mac_E258,Location icon should now be in state 'Active',Mac,O O O O O O O O O O O O O O O O O O O O O O O O O O O O O O O O O O O O O O O O O O O O O O O O,0,0,0,0,0,0,0,0,0,0
162,Jul,1,13:47:33,calvisitor-10-105-160-95,kernel,0,,en0: 802.11d country code set to 'X3'.,Mac_E206,en0: <*> country code set to '<*>'.,Mac,O O O O O LOI O O O O O O O,0,1,0,0,0,0,0,0,0,0
166,Jul,1,14:01:24,calvisitor-10-105-160-95,kernel,0,,"ARPT: 627305.613279: wl0: setup_keepalive: Seq: 1664112163, Ack: 818851215, Win size: 4096",Mac_E148,"ARPT: <*>: wl0: setup_keepalive: Seq: <*>, Ack: <*>, Win size: <*>",Mac,O O O O O O O O TDA O OBA O,0,0,0,0,0,1,0,1,0,0
170,Jul,1,14:29:01,calvisitor-10-105-160-95,sandboxd,129,[10018],QQ(10018) deny mach-lookup com.apple.networking.captivenetworksupport,Mac_E51,<*>(<*>) deny mach-lookup com.apple.networking.captivenetworksupport,Mac,O O O O O O OID O O,1,0,0,0,0,0,0,0,0,0
173,Jul,1,14:52:03,calvisitor-10-105-160-95,kernel,0,,[HID] [MT] AppleMultitouchDevice::willTerminate entered,Mac_E36,[HID] [MT] AppleMultitouchDevice::willTerminate entered,Mac,O O O O O O O O O O,0,0,0,0,0,0,0,0,0,0
174,Jul,1,14:52:03,calvisitor-10-105-160-95,blued,85,,[BluetoothHIDDeviceController] EventServiceDisconnectedCallback,Mac_E24,[BluetoothHIDDeviceController] EventServiceDisconnectedCallback,Mac,O O O O O O LOI O O O O O O O O O O O O O O TDA O,0,1,0,0,0,1,0,0,0,0
175,Jul,1,15:05:42,calvisitor-10-105-160-95,kernel,0,,PMStats: Hibernate read took 197 ms,Mac_E291,PMStats: Hibernate read took <*> ms,Mac,O O O O O O LOI O O O O O O O O O O O O O O TDA O,0,1,0,0,0,1,0,0,0,0
177,Jul,1,15:05:51,calvisitor-10-105-160-95,com.apple.AddressBook.InternetAccountsBridge,31654,,dnssd_clientstub ConnectToServer: connect() failed path:/var/run/mDNSResponder Socket:4 Err:-1 Errno:1 Operation not permitted,Mac_E202,dnssd_clientstub ConnectToServer: connect() failed path:<*> Socket:<*> Err:<*> Errno:<*> Operation not permitted,Mac,O O O O O O O O O O OID O O O O O O O O,1,0,0,0,0,0,0,0,0,0
178,Jul,1,19:43:22,calvisitor-10-105-160-95,kernel,0,,"pages 1471315, wire 491253, act 449877, inact 3, cleaned 0 spec 5, zf 23, throt 0, compr 345876, xpmapped 40000",Mac_E282,"pages <*>, wire <*>, act <*>, inact <*>, cleaned <*> spec <*>, zf <*>, throt <*>, compr <*>, xpmapped <*>",Mac,O O O O O O OID LOI O O O O O O O O O O,1,1,0,0,0,0,0,0,0,0
179,Jul,1,19:43:22,calvisitor-10-105-160-95,VDCAssistant,213,,"VDCAssistant:  Found a camera (0x1430000005ac8290) , but was not able to start it up (0x0 -- (os/kern) successful)",Mac_E332,"VDCAssistant: Found a camera (<*>) , but was not able to start it up (<*> -- (os/kern) successful)",Mac,O O O O O O,0,0,0,0,0,0,0,0,0,0
180,Jul,1,19:43:22,calvisitor-10-105-160-95,WindowServer,184,,handle_will_sleep_auth_and_shield_windows: Reordering authw 0x7fa823a04400(2004) (lock state: 3),Mac_E224,handle_will_sleep_auth_and_shield_windows: Reordering authw <*>(<*>) (lock state: <*>),Mac,O O O O O O O O O O O O O,0,0,0,0,0,0,0,0,0,0
183,Jul,1,19:46:26,calvisitor-10-105-163-202,GoogleSoftwareUpdateAgent,31702,,"2017-07-01 19:46:26.133 GoogleSoftwareUpdateAgent[31702/0x7000002a0000] [lvl=2] -[KSAgentApp(KeystoneThread) runKeystonesInThreadWithArg:] Checking with local engine: <KSUpdateEngine:0x100259c60 ticketStore=<KSPersistentTicketStore:0x100253770 store=<KSKeyedPersistentStore:0x100254d10 path=""/Users/xpc/Library/Google/GoogleSoftwareUpdate/TicketStore/Keystone.ticketstore"" lockFile=<KSLockFile:0x100254d80 path=""/Users/xpc/Library/Google/GoogleSoftwareUpdate/TicketStore/Keystone.ticketstore.lock"" locked=NO > >> processor=<KSActionProcessor:0x100259e70 delegate=<KSUpdateEngine:0x100259c60> isProcessing=NO actionsCompleted=0 progress=0.00 errors=0 currentActionErrors=0 events=0 currentActionEvents=0 actionQueue=( ) > delegate=(null) serverInfoStore=<KSServerPrivateInfoStore:0x1002594d0 path=""/Users/xpc/Library/Google/GoogleSoftwareUpdate/Servers""> errors=0 >",Mac_E80,"<*>-<*>-<*> <*>:<*>:<*> GoogleSoftwareUpdateAgent[<*>/<*>] [lvl=<*>] -[KSAgentApp(KeystoneThread) runKeystonesInThreadWithArg:] Checking with local engine: <KSUpdateEngine:<*> ticketStore=<KSPersistentTicketStore:<*> store=<KSKeyedPersistentStore:<*> path=""<*>"" lockFile=<KSLockFile:<*> path=""<*>"" locked=NO > >> processor=<KSActionProcessor:<*> delegate=<KSUpdateEngine:<*> isProcessing=NO actionsCompleted=<*> progress=<*> errors=<*> currentActionErrors=<*> events=<*> currentActionEvents=<*> actionQueue=( ) > delegate=(<*>) serverInfoStore=<KSServerPrivateInfoStore:<*> path=<*> errors=<*> >",Mac,O O O O O O O O O O OID O O STC,1,0,0,0,0,0,0,0,1,0
184,Jul,1,19:46:42,calvisitor-10-105-163-202,iconservicesagent,328,,-[ISGenerateImageOp generateImageWithCompletion:] Failed to composit image for descriptor <ISBindingImageDescriptor: 0x7f9950712080>.,Mac_E40,-[ISGenerateImageOp generateImageWithCompletion:] Failed to composit image for descriptor <ISBindingImageDescriptor: <*>.,Mac,O O O O O O OID O O O O LOI,1,1,0,0,0,0,0,0,0,0
186,Jul,1,19:50:12,calvisitor-10-105-163-202,quicklookd,31687,,Error returned from iconservicesagent: (null),Mac_E214,Error returned from iconservicesagent: (<*>),Mac,O O O O O O O O O O O O O O O,0,0,0,0,0,0,0,0,0,0
187,Jul,1,20:13:23,calvisitor-10-105-163-202,Safari,9852,,tcp_connection_tls_session_error_callback_imp 1977 __tcp_connection_tls_session_callback_write_block_invoke.434 error 22,Mac_E319,tcp_connection_tls_session_error_callback_imp <*> __tcp_connection_tls_session_callback_write_block_invoke.<*> error <*>,Mac,O O O O O O O O,0,0,0,0,0,0,0,0,0,0
