LineId,Month,Date,Time,User,Component,PID,Address,Content,EventId,EventTemplate,System,VariableTemplate,OID,LOI,OBN,TID,SID,TDA,CRS,OBA,STC,OTP
1183,Jul,5,04:12:22,calvisitor-10-105-163-10,kernel,0,,**** [BroadcomBluetoothHostControllerUSBTransport][start] -- Completed (matched on Device) -- 0x6000 ****,Mac_E5,**** [BroadcomBluetoothHostControllerUSBTransport][start] -- Completed (matched on Device) -- <*> ****,Mac,O O O O O O O O O O OID O O O O O O O O,1,0,0,0,0,0,0,0,0,0
1184,Jul,5,10:31:18,calvisitor-10-105-163-10,kernel,0,,"hibernate_newruntime_map time: 0 ms, IOPolledFilePollersOpen(), ml_get_interrupts_enabled 0",Mac_E232,"hibernate_newruntime_map time: <*> ms, IOPolledFilePollersOpen(), ml_get_interrupts_enabled <*>",Mac,O O O O O O O O O TID,0,0,0,1,0,0,0,0,0,0
1186,Jul,5,10:31:18,calvisitor-10-105-163-10,kernel,0,,vm_compressor_fastwake_warmup (581519 - 591525) - starting,Mac_E333,vm_compressor_fastwake_warmup (<*> - <*>) - starting,Mac,O O O O O O LOI O O O O O O O O O O O O O O TDA O,0,1,0,0,0,1,0,0,0,0
1188,Jul,5,10:31:19,calvisitor-10-105-163-10,identityservicesd,272,,"<IMMacNotificationCenterManager: 0x7ff1b2e00ba0>: Updating enabled: YES   (Topics: ( ""com.apple.private.alloy.icloudpairing"", ""com.apple.private.alloy.continuity.encryption"", ""com.apple.private.alloy.continuity.activity"", ""com.apple.ess"", ""com.apple.private.ids"", ""com.apple.private.alloy.phonecontinuity"", ""com.apple.madrid"", ""com.apple.private.ac"", ""com.apple.private.alloy.phone.auth"", ""com.apple.private.alloy.keychainsync"", ""com.apple.private.alloy.fmf"", ""com.apple.private.alloy.sms"", ""com.apple.private.alloy.screensharing"", ""com.apple.private.alloy.maps"", ""com.apple.private.alloy.thumper.keys"", ""com.apple.private.alloy.continuity.tethering"" ))",Mac_E107,<IMMacNotificationCenterManager: <*>: Updating enabled: YES (Topics: (<*>)),Mac,O O O O O LOI O O O O LOI O O O O O O,0,2,0,0,0,0,0,0,0,0
1199,Jul,5,10:52:16,calvisitor-10-105-160-179,ksfetch,35863,,2017-07-05 10:52:16.779 ksfetch[35863/0x7fff79824000] [lvl=2] main() Fetcher received a request: <NSMutableURLRequest: 0x100501610> { URL: https://tools.google.com/service/update2?cup2hreq=a7873a51b1cb55518e420d20dff47d463781ed3f7aa83c3153129eefb148070b&cup2key=7:2501762722 },Mac_E94,<*>-<*>-<*> <*>:<*>:<*> ksfetch[<*>/<*>] [lvl=<*>] main() Fetcher received a request: <NSMutableURLRequest: <*> { URL: <*> },Mac,O O O O O O OID LOI O O O O O O O O O O,1,1,0,0,0,0,0,0,0,0
1200,Jul,5,10:52:16,calvisitor-10-105-160-179,GoogleSoftwareUpdateAgent,35861,,2017-07-05 10:52:16.977 GoogleSoftwareUpdateAgent[35861/0x700000323000] [lvl=2] -[KSPrefetchAction performAction] KSPrefetchAction no updates to prefetch.,Mac_E87,<*>-<*>-<*> <*>:<*>:<*> GoogleSoftwareUpdateAgent[<*>/<*>] [lvl=<*>] -[KSPrefetchAction performAction] KSPrefetchAction no updates to prefetch.,Mac,O O O O O LOI O O O O O O O,0,1,0,0,0,0,0,0,0,0
1205,Jul,5,10:58:44,calvisitor-10-105-160-179,imagent,355,,<IMMacNotificationCenterManager: 0x7fdcc9d16380>: notification observer: com.apple.FaceTime   notification: __CFNotification 0x7fdcc9d19110 {name = _NSDoNotDisturbEnabledNotification},Mac_E105,<IMMacNotificationCenterManager: <*>: notification observer: com.apple.FaceTime notification: __CFNotification <*> {name = _NSDoNotDisturbEnabledNotification},Mac,O O O O O O OID OID O O,2,0,0,0,0,0,0,0,0,0
1211,Jul,5,11:39:38,authorMacBook-Pro,corecaptured,35877,,CCProfileMonitor::freeResources done,Mac_E178,CCProfileMonitor::freeResources done,Mac,O O O O O O O O STC,0,0,0,0,0,0,0,0,1,0
1215,Jul,5,11:42:53,calvisitor-10-105-160-226,identityservicesd,272,,<IMMacNotificationCenterManager: 0x7ff1b2d17980>:    NC Disabled: NO,Mac_E102,<IMMacNotificationCenterManager: <*>: NC Disabled: NO,Mac,O O O O O O O O O O O LOI O O LOI,0,2,0,0,0,0,0,0,0,0
1216,Jul,5,11:42:53,calvisitor-10-105-160-226,identityservicesd,272,,<IMMacNotificationCenterManager: 0x7ff1b2d17980>:   DND Enabled: NO,Mac_E103,<IMMacNotificationCenterManager: <*>: DND Enabled: NO,Mac,O O O O O O LOI O O O O O O O O O O O O O O TDA O,0,1,0,0,0,1,0,0,0,0
1229,Jul,5,13:44:18,calvisitor-10-105-160-226,com.apple.AddressBook.InternetAccountsBridge,646,,Daemon connection invalidated!,Mac_E196,Daemon connection invalidated!,Mac,O O O O O O O O TDA O OBA O,0,0,0,0,0,1,0,1,0,0
1250,Jul,5,14:56:09,authorMacBook-Pro,kernel,0,,"ARPT: 724869.297011: IOPMPowerSource Information: onWake,  SleepType: Normal Sleep,  'ExternalConnected': No, 'TimeRemaining': 4551,",Mac_E137,"ARPT: <*>: IOPMPowerSource Information: onWake, SleepType: Normal Sleep, 'ExternalConnected': No, 'TimeRemaining': <*>,",Mac,O O O O O O LOI O O O O O O O O O O O O O O TDA O,0,1,0,0,0,1,0,0,0,0
1253,Jul,5,15:26:36,calvisitor-10-105-162-98,kernel,0,,IOHibernatePollerOpen(0),Mac_E249,IOHibernatePollerOpen(<*>),Mac,O O O O O O O O O O,0,0,0,0,0,0,0,0,0,0
1254,Jul,5,15:26:36,calvisitor-10-105-162-98,kernel,0,,"hibernate_machine_init: state 2, image pages 446175, sum was d4e6c0b2, imageSize 0x2aea6000, image1Size 0x215a4000, conflictCount 5848, nextFree 5887",Mac_E231,"hibernate_machine_init: state <*>, image pages <*>, sum was <*>, imageSize <*>, image1Size <*>, conflictCount <*>, nextFree <*>",Mac,O O O O O O O O O O,0,0,0,0,0,0,0,0,0,0
1258,Jul,5,15:55:35,calvisitor-10-105-162-98,kernel,0,,hibernate_rebuild completed - took 10042450943433 msecs,Mac_E236,hibernate_rebuild completed - took <*> msecs,Mac,O O O O O O O O O,0,0,0,0,0,0,0,0,0,0
1259,Jul,5,15:55:35,calvisitor-10-105-162-98,kernel,0,,AppleActuatorDevice::stop Entered,Mac_E114,AppleActuatorDevice::stop Entered,Mac,O O O O O O OID LOI O,1,1,0,0,0,0,0,0,0,0
1260,Jul,5,15:55:35,calvisitor-10-105-162-98,kernel,0,,AppleActuatorDevice::start Entered,Mac_E113,AppleActuatorDevice::start Entered,Mac,O O O O O O STC O O STC O O O O O O O O O O O O O O,0,0,0,0,0,0,0,0,2,0
1264,Jul,5,16:04:10,calvisitor-10-105-162-107,kernel,0,,"bitmap_size 0x7f0fc, previewSize 0x4028, writing 488299 pages @ 0x97144",Mac_E156,"bitmap_size <*>, previewSize <*>, writing <*> pages @ <*>",Mac,O O O O O O OID LOI O O,1,1,0,0,0,0,0,0,0,0
1271,Jul,5,16:06:03,authorMacBook-Pro,corecaptured,36091,,"CCFile::captureLog Received Capture notice id: 1499295963.492254, reason = RoamFail:sts:1_rsn:1",Mac_E168,"CCFile::captureLog Received Capture notice id: <*>, reason = RoamFail:sts:<NUM>_rsn:<NUM>",Mac,O O O O O O O O O O OID O O O O O O O O,1,0,0,0,0,0,0,0,0,0
1274,Jul,5,16:12:56,authorMacBook-Pro,kernel,0,,en0: manual intervention required!,Mac_E209,en0: manual intervention required!,Mac,O O O O O O O O O O TDA O,0,0,0,0,0,1,0,0,0,0
1276,Jul,5,16:13:17,calvisitor-10-105-162-107,QQ,10018,,"DB Error: 1 ""no such table: tb_c2cMsg_2658655094""",Mac_E197,"DB Error: <*> ""no such table: <*>""",Mac,O O O O O O LOI O O O O O O O O O O O O O O TDA O,0,1,0,0,0,1,0,0,0,0
1277,Jul,5,16:18:06,calvisitor-10-105-162-107,GoogleSoftwareUpdateAgent,36128,,"2017-07-05 16:18:06.450 GoogleSoftwareUpdateAgent[36128/0x7000002a0000] [lvl=2] -[KSOutOfProcessFetcher beginFetchWithDelegate:] KSOutOfProcessFetcher fetching from URL: ""https://tools.google.com/service/update2?cup2hreq=ac844e04cbb398fcef4cf81b4ffc44a3ebc863e89d19c0b5d39d02d78d26675b&cup2key=7:677488741""",Mac_E83,"<*>-<*>-<*> <*>:<*>:<*> GoogleSoftwareUpdateAgent[<*>/<*>] [lvl=<*>] -[KSOutOfProcessFetcher beginFetchWithDelegate:] KSOutOfProcessFetcher fetching from URL: ""<*>""",Mac,O O O O O O O O O,0,0,0,0,0,0,0,0,0,0
1290,Jul,5,16:58:24,airbears2-10-142-108-38,imagent,355,,<IMMacNotificationCenterManager: 0x7fdcc9d16380>: Updating enabled: NO   (Topics: ( )),Mac_E106,<IMMacNotificationCenterManager: <*>: Updating enabled: NO (Topics: ( )),Mac,O O O O O O OID O O O O O O O O O TDA,1,0,0,0,0,1,0,0,0,0
1311,Jul,5,18:19:59,authorMacBook-Pro,configd,53,,"arp_client_transmit(en0) failed, Network is down (50)",Mac_E123,"arp_client_transmit(<*>) failed, Network is down (<*>)",Mac,O O O O O O O O O O OID O O O O O O O O,1,0,0,0,0,0,0,0,0,0
1315,Jul,5,18:20:06,authorMacBook-Pro,networkd,195,,-[NETClientConnection evaluateCrazyIvan46] CI46 - Perform CrazyIvan46! QQ.10018 tc23407 119.81.102.227:80,Mac_E43,-[NETClientConnection evaluateCrazyIvan46] CI46 - Perform CrazyIvan46! <*> <*> <*>:<*>,Mac,O O O O O O O O TDA O OBA O,0,0,0,0,0,1,0,1,0,0
1319,Jul,5,19:00:37,authorMacBook-Pro,networkd,195,,-[NETClientConnection effectiveBundleID] using process name CalendarAgent as bundle ID (this is expected for daemons without bundle ID,Mac_E42,-[NETClientConnection effectiveBundleID] using process name CalendarAgent as bundle ID (this is expected for daemons without bundle ID,Mac,O O O O O LOI O O O O O O O,0,1,0,0,0,0,0,0,0,0
1327,Jul,5,20:16:55,calvisitor-10-105-160-210,kernel,0,,could discard act 242131 inact 107014 purgeable 254830 spec 128285 cleaned 0,Mac_E194,could discard act <*> inact <*> purgeable <*> spec <*> cleaned <*>,Mac,O O O O O O OID LOI O,1,1,0,0,0,0,0,0,0,0
1328,Jul,5,20:16:55,calvisitor-10-105-160-210,kernel,0,,"booter start at 1251 ms smc 0 ms, [18, 0, 0] total 367 ms, dsply 0, 0 ms, tramp 1080 ms",Mac_E158,"booter start at <*> ms smc <*> ms, [<*>, <*>, <*>] total <*> ms, dsply <*>, <*> ms, tramp <*> ms",Mac,O O O O O O OID O,1,0,0,0,0,0,0,0,0,0
1329,Jul,5,20:16:56,calvisitor-10-105-160-210,blued,85,,"hostControllerOnline - Number of Paired devices = 1, List of Paired devices = ( ""84-41-67-32-db-e1"" )",Mac_E245,"hostControllerOnline - Number of Paired devices = <*>, List of Paired devices = ( ""<*>-<*>-<*>-<*>-<*>-<*>"" )",Mac,O O O O O O,0,0,0,0,0,0,0,0,0,0
1344,Jul,5,23:09:36,calvisitor-10-105-160-22,kernel,0,,**** [BroadcomBluetoothHostController][SetupController] -- Delay HCI Reset by 300ms  ****,Mac_E4,**** [BroadcomBluetoothHostController][SetupController] -- Delay HCI Reset by <*> ****,Mac,O O O O O LOI O O O O O,0,1,0,0,0,0,0,0,0,0
1346,Jul,5,23:50:09,calvisitor-10-105-160-22,kernel,0,,AppleActuatorHIDEventDriver: stop,Mac_E118,AppleActuatorHIDEventDriver: stop,Mac,O O O O O O O O O O O,0,0,0,0,0,0,0,0,0,0
1347,Jul,5,23:50:09,calvisitor-10-105-160-22,kernel,0,,**** [IOBluetoothHostControllerUSBTransport][start] -- completed -- result = TRUE -- 0xb000 ****,Mac_E8,**** [IOBluetoothHostControllerUSBTransport][start] -- completed -- result = <*> -- <*> ****,Mac,O O O O O LOI O O O O O O O,0,1,0,0,0,0,0,0,0,0
1348,Jul,5,23:50:09,authorMacBook-Pro,kernel,0,,AppleActuatorDeviceUserClient::start Entered,Mac_E115,AppleActuatorDeviceUserClient::start Entered,Mac,O O O O O O O O O O O O O O O O O O,0,0,0,0,0,0,0,0,0,0
1354,Jul,6,00:30:37,authorMacBook-Pro,ksfetch,36439,,2017-07-06 00:30:37.064 ksfetch[36439/0x7fff79824000] [lvl=2] main() Fetcher is exiting.,Mac_E93,<*>-<*>-<*> <*>:<*>:<*> ksfetch[<*>/<*>] [lvl=<*>] main() Fetcher is exiting.,Mac,O O O O O O,0,0,0,0,0,0,0,0,0,0
1359,Jul,6,01:11:09,authorMacBook-Pro,kernel,0,,"Google Chrome He[36456] triggered unnest of range 0x7fff93c00000->0x7fff93e00000 of DYLD shared region in VM map 0x77c9114550458e7b. While not abnormal for debuggers, this increases system memory footprint until the target exits.",Mac_E222,"Google Chrome He[<*>] triggered unnest of range <*>-<*> of DYLD shared region in VM map <*>. While not abnormal for debuggers, this increases system memory footprint until the target exits.",Mac,O O O O O O OID O O O OID O O OBA OID O OBA O OBA,3,0,0,0,0,0,0,3,0,0
1377,Jul,6,03:53:08,calvisitor-10-105-160-37,kernel,0,,hibernate_page_list_setall(preflight 1) start,Mac_E235,hibernate_page_list_setall(preflight <*>) start,Mac,O O O O O O O O O O O O O O O O O O O O O O,0,0,0,0,0,0,0,0,0,0
1378,Jul,6,03:53:08,calvisitor-10-105-160-37,kernel,0,,hibernate_page_list_setall time: 603 ms,Mac_E234,hibernate_page_list_setall time: <*> ms,Mac,O O O O O O O O O O O O O O O O O,0,0,0,0,0,0,0,0,0,0
1379,Jul,6,03:53:08,calvisitor-10-105-160-37,kernel,0,,IOPolledFilePollersOpen(0) 6 ms,Mac_E251,IOPolledFilePollersOpen(<*>) <*> ms,Mac,O O O O O O O O O LOI,0,1,0,0,0,0,0,0,0,0
1383,Jul,6,04:33:35,calvisitor-10-105-160-37,kernel,0,,hibernate_teardown completed - discarded 93932,Mac_E240,hibernate_teardown completed - discarded <*>,Mac,O O O O O O O O O O O O O,0,0,0,0,0,0,0,0,0,0
1384,Jul,6,04:33:35,calvisitor-10-105-160-37,kernel,0,,AppleActuatorDeviceUserClient::stop Entered,Mac_E116,AppleActuatorDeviceUserClient::stop Entered,Mac,O O O O O O O O O O OID O O O O O O O O,1,0,0,0,0,0,0,0,0,0
1388,Jul,6,05:04:00,calvisitor-10-105-163-168,kernel,0,,[IOBluetoothHostController::setConfigState] calling registerService,Mac_E39,[IOBluetoothHostController::setConfigState] calling registerService,Mac,O O O O O O O O O O OID O O STC,1,0,0,0,0,0,0,0,1,0
1391,Jul,6,08:32:37,authorMacBook-Pro,kernel,0,,[HID] [MT] AppleMultitouchDevice::start entered,Mac_E35,[HID] [MT] AppleMultitouchDevice::start entered,Mac,O O O O O O O O O O O O O O O,0,0,0,0,0,0,0,0,0,0
1393,Jul,6,08:32:40,authorMacBook-Pro,AddressBookSourceSync,36544,,"[CardDAVPlugin-ERROR] -getPrincipalInfo:[_controller supportsRequestCompressionAtURL:https://13957525385%40163.com@p28-contacts.icloud.com/874161398/principal/] Error Domain=NSURLErrorDomain Code=-1009 ""The Internet connection appears to be offline."" UserInfo={NSUnderlyingError=0x7f8de0c0dc70 {Error Domain=kCFErrorDomainCFNetwork Code=-1009 ""The Internet connection appears to be offline."" UserInfo={NSErrorFailingURLStringKey=https://13957525385%40163.com@p28-contacts.icloud.com/874161398/principal/, NSErrorFailingURLKey=https://13957525385%40163.com@p28-contacts.icloud.com/874161398/principal/, _kCFStreamErrorCodeKey=8, _kCFStreamErrorDomainKey=12, NSLocalizedDescription=The Internet connection appears to be offline.}}, NSErrorFailingURLStringKey=https://13957525385%40163.com@p28-contacts.icloud.com/874161398/principal/, NSErrorFailingURLKey=https://13957525385%40163.com@p28-contacts.icloud.com/874161398/principal/, _kCFStreamErrorDomainKey=12, _kCFStreamErrorCodeKey=8, NSLocalizedDescription=The Internet connection appears to be offline.}",Mac_E26,"[CardDAVPlugin-ERROR] -getPrincipalInfo:[_controller supportsRequestCompressionAtURL:<*>] Error Domain=NSURLErrorDomain Code=<*> ""The Internet connection appears to be offline."" UserInfo={NSUnderlyingError=<*> {Error Domain=kCFErrorDomainCFNetwork Code=<*> ""The Internet connection appears to be offline."" UserInfo={NSErrorFailingURLStringKey=<*>, NSErrorFailingURLKey=<*>, _kCFStreamErrorCodeKey=<*>, _kCFStreamErrorDomainKey=<*>, NSLocalizedDescription=The Internet connection appears to be offline.}}, NSErrorFailingURLStringKey=<*>, NSErrorFailingURLKey=<*>, _kCFStreamErrorDomainKey=<*>, _kCFStreamErrorCodeKey=<*>, NSLocalizedDescription=The Internet connection appears to be offline.}",Mac,O O O O O O O O LOI O LOI O LOI,0,3,0,0,0,0,0,0,0,0
1394,Jul,6,08:32:45,authorMacBook-Pro,netbiosd,36551,,Unable to start NetBIOS name service:,Mac_E326,Unable to start NetBIOS name service:,Mac,O O O O O O LOI O O O O O O O O O O O O O O TDA O,0,1,0,0,0,1,0,0,0,0
1399,Jul,6,08:35:08,calvisitor-10-105-163-253,corecaptured,36565,,Got an XPC error: Connection invalid,Mac_E223,Got an XPC error: Connection invalid,Mac,O O O O O O O O O O O O O O,0,0,0,0,0,0,0,0,0,0
1402,Jul,6,09:08:22,calvisitor-10-105-163-253,loginwindow,94,,-[SFLListManager(ServiceReplyProtocol) notifyChanges:toListWithIdentifier:] Notified of item changes to list with identifier com.apple.LSSharedFileList.RecentApplications,Mac_E46,-[SFLListManager(ServiceReplyProtocol) notifyChanges:toListWithIdentifier:] Notified of item changes to list with identifier com.apple.LSSharedFileList.RecentApplications,Mac,O O O O O O O O O LOI OID STC STC O O O,1,1,0,0,0,0,0,0,2,0
1405,Jul,6,09:24:14,calvisitor-10-105-163-253,GoogleSoftwareUpdateAgent,36726,,2017-07-06 09:24:14.733 GoogleSoftwareUpdateAgent[36726/0x7000002a0000] [lvl=2] -[KSMultiUpdateAction performAction] KSPromptAction had no updates to apply.,Mac_E81,<*>-<*>-<*> <*>:<*>:<*> GoogleSoftwareUpdateAgent[<*>/<*>] [lvl=<*>] -[KSMultiUpdateAction performAction] KSPromptAction had no updates to apply.,Mac,O O O O O O O O STC O O O STC,0,0,0,0,0,0,0,0,2,0
1406,Jul,6,09:31:18,calvisitor-10-105-163-253,WindowServer,184,,no sleep images for WillPowerOffWithImages,Mac_E274,no sleep images for WillPowerOffWithImages,Mac,O O O O O O,0,0,0,0,0,0,0,0,0,0
1410,Jul,6,10:12:58,calvisitor-10-105-163-253,ChromeExistion,36773,,ChromeExistion main isUndetectWithCommand = 1,Mac_E186,ChromeExistion main isUndetectWithCommand = <*>,Mac,O O O O O O O O O,0,0,0,0,0,0,0,0,0,0
1411,Jul,6,10:13:12,calvisitor-10-105-163-253,ChromeExistion,36775,,after trim url = https://www.google.com/_/chrome/newtab?rlz=1C5CHFA_enHK732HK732&espv=2&ie=UTF-8,Mac_E108,after trim url = https://www.google.com/_/chrome/newtab?rlz=<*>&espv=<*>&ie=UTF-<*>,Mac,O O O O O O O O O O O O O O O O O LOI O O STC O O O O O O O O O O O O LOI,0,2,0,0,0,0,0,0,1,0
1413,Jul,6,10:17:44,calvisitor-10-105-163-253,ChromeExistion,36801,,"ChromeExistion main strSendMsg = {""websitekey"":false,""commandkey"":true,""browserkey"":true}",Mac_E187,"ChromeExistion main strSendMsg = {""websitekey"":<*>,""commandkey"":<*>,""browserkey"":<*>}",Mac,O O O O O O O STC O O O OTP,0,0,0,0,0,0,0,0,1,1
1416,Jul,6,10:52:50,calvisitor-10-105-163-253,ChromeExistion,36852,,url host = www.baidu.com,Mac_E330,url host = <*>,Mac,O O O O O O O O O O O O O O O O O O O O O O O O O O O O O O O,0,0,0,0,0,0,0,0,0,0
1417,Jul,6,10:53:30,calvisitor-10-105-163-253,ChromeExistion,36855,,the url = http://baike.baidu.com/item/%E8%93%9D%E9%87%87%E5%92%8C/462624?fr=aladdin,Mac_E322,the url = <*>,Mac,O O O O O O O O O O OID O O O O O O O O,1,0,0,0,0,0,0,0,0,0
1428,Jul,6,12:00:53,authorMacBook-Pro,CalendarAgent,279,,[com.apple.calendar.store.log.caldav.queue] [Adding [<CalDAVAccountRefreshQueueableOperation: 0x7fa11d67f3b0; Sequence: 0>] to failed operations.],Mac_E31,[com.apple.calendar.store.log.caldav.queue] [Adding [<CalDAVAccountRefreshQueueableOperation: <*>; Sequence: <*>] to failed operations.],Mac,O O O O O O O O O O O O O O O O O O O O O O O O O O O O O O O O O O O O O O O O O O O O O,0,0,0,0,0,0,0,0,0,0
1466,Jul,6,14:08:48,authorMacBook-Pro,kernel,0,,hibernate_rebuild started,Mac_E237,hibernate_rebuild started,Mac,O O O O O O O O O O OID O O STC,1,0,0,0,0,0,0,0,1,0
1476,Jul,6,14:17:00,calvisitor-10-105-162-178,com.apple.xpc.launchd,1,com.apple.xpc.launchd.domain.user.501,"Service ""com.apple.xpc.launchd.unmanaged.loginwindow.94"" tried to hijack endpoint ""com.apple.tsm.uiserver"" from owner: com.apple.SystemUIServer.agent",Mac_E306,"Service ""com.apple.xpc.launchd.unmanaged.loginwindow.<*>"" tried to hijack endpoint ""com.apple.tsm.uiserver"" from owner: com.apple.SystemUIServer.agent",Mac,O O O O O O O O O O,0,0,0,0,0,0,0,0,0,0
1487,Jul,6,14:57:16,calvisitor-10-105-162-178,GoogleSoftwareUpdateAgent,37059,,2017-07-06 14:57:16.667 GoogleSoftwareUpdateAgent[37059/0x7000002a0000] [lvl=2] -[KSAgentApp(KeystoneDelegate) updateEngineFinishedWithErrors:] Keystone finished: errors=0,Mac_E78,<*>-<*>-<*> <*>:<*>:<*> GoogleSoftwareUpdateAgent[<*>/<*>] [lvl=<*>] -[KSAgentApp(KeystoneDelegate) updateEngineFinishedWithErrors:] Keystone finished: errors=<*>,Mac,O O O O O O O OBA,0,0,0,0,0,0,0,1,0,0
1524,Jul,6,18:09:02,calvisitor-10-105-162-178,kernel,0,,Sandbox: com.apple.WebKit(9854) deny(1) file-read-data /private/etc/hosts,Mac_E297,Sandbox: <*>(<*>) deny(<*>) file-read-data <*>,Mac,O O O O O LOI O O O O,0,1,0,0,0,0,0,0,0,0
1526,Jul,6,18:22:57,calvisitor-10-105-162-178,AirPlayUIAgent,415,,2017-07-06 06:22:57.163367 PM [AirPlayUIAgent] BecomingInactive: NSWorkspaceWillSleepNotification,Mac_E97,<*>-<*>-<*> <*>:<*>:<*> PM [AirPlayUIAgent] BecomingInactive: NSWorkspaceWillSleepNotification,Mac,O O O O O OID O O,1,0,0,0,0,0,0,0,0,0
1532,Jul,6,18:37:20,calvisitor-10-105-162-178,kernel,0,,full wake request (reason 2) 30914 ms,Mac_E221,full wake request (reason <*>) <*> ms,Mac,O O O O O O O O O O O STC O O O O,0,0,0,0,0,0,0,0,1,0
1539,Jul,6,18:51:42,calvisitor-10-105-162-178,kernel,0,,kern_open_file_for_direct_io(0),Mac_E255,kern_open_file_for_direct_io(<*>),Mac,O O O O O O O O O O O O O O OID,1,0,0,0,0,0,0,0,0,0
1561,Jul,6,19:58:57,calvisitor-10-105-162-178,kernel,0,,"PM response took 129 ms (10018, QQ)",Mac_E289,"PM response took <*> ms (<*>, QQ)",Mac,O O O O O O O OID,1,0,0,0,0,0,0,0,0,0
1574,Jul,6,20:46:03,calvisitor-10-105-162-178,GoogleSoftwareUpdateAgent,37316,,"2017-07-06 20:46:03.869 GoogleSoftwareUpdateAgent[37316/0x7000002a0000] [lvl=2] -[KSOutOfProcessFetcher beginFetchWithDelegate:] KSOutOfProcessFetcher start fetch from URL: ""https://tools.google.com/service/update2?cup2hreq=5e15fbe422c816bef7c133cfffdb516e16923579b9be2dfae4d7d8d211b25017&cup2key=7:780377214""",Mac_E84,"<*>-<*>-<*> <*>:<*>:<*> GoogleSoftwareUpdateAgent[<*>/<*>] [lvl=<*>] -[KSOutOfProcessFetcher beginFetchWithDelegate:] KSOutOfProcessFetcher start fetch from URL: ""<*>""",Mac,O O O O O O O O O O O LOI O O LOI,0,2,0,0,0,0,0,0,0,0
1578,Jul,6,21:08:02,calvisitor-10-105-162-178,Preview,11512,,"Page bounds {{0, 0}, {400, 400}}",Mac_E281,"Page bounds {{<*>, <*>}, {<*>, <*>}}",Mac,O O O O O O O O O TID,0,0,0,1,0,0,0,0,0,0
1579,Jul,6,21:22:31,calvisitor-10-105-162-178,WeChat,24144,,Failed to connect (titleField) outlet from (MMSessionPickerChoosenRowView) to (NSTextField): missing setter or instance variable,Mac_E217,Failed to connect (titleField) outlet from (MMSessionPickerChoosenRowView) to (NSTextField): missing setter or instance variable,Mac,O O O O O OID O O O O O O O O O,1,0,0,0,0,0,0,0,0,0
1580,Jul,6,22:05:30,calvisitor-10-105-162-178,CalendarAgent,279,,[com.apple.calendar.store.log.caldav.queue] [Account xpc_ben@163.com@https://caldav.163.com/caldav/principals/users/xpc_ben%40163.com/ timed out when executing operation: <CalDAVAccountRefreshQueueableOperation: 0x7fa11f9f2290; Sequence: 0>],Mac_E29,[com.apple.calendar.store.log.caldav.queue] [Account <*> timed out when executing operation: <CalDAVAccountRefreshQueueableOperation: <*>; Sequence: <*>],Mac,O O O O O O O O O O O OBA,0,0,0,0,0,0,0,1,0,0
1582,Jul,6,22:33:18,calvisitor-10-105-162-178,CalendarAgent,279,,"[com.apple.calendar.store.log.caldav.queue] [Account refresh failed with error: Error Domain=CoreDAVHTTPStatusErrorDomain Code=502 ""(null)"" UserInfo={AccountName=163, CalDAVErrFromRefresh=YES, CoreDAVHTTPHeaders=<CFBasicHash 0x7fa11fe7a810 [0x7fff7abc1440]>{type = immutable dict, count = 5, entries => 0 : Connection = <CFString 0x7fff7ab1aea0 [0x7fff7abc1440]>{contents = ""keep-alive""} 3 : Content-Type = text/html 4 : Content-Length = 166 5 : Server = nginx 6 : Date = <CFString 0x7fa11ac2ab80 [0x7fff7abc1440]>{contents = ""Fri, 07 Jul 2017 05:32:43 GMT""} } }]",Mac_E30,"[com.apple.calendar.store.log.caldav.queue] [Account refresh failed with error: Error Domain=CoreDAVHTTPStatusErrorDomain Code=<*> ""(<*>)"" UserInfo={AccountName=<*>, CalDAVErrFromRefresh=YES, CoreDAVHTTPHeaders=<CFBasicHash <*> [<*>]>{type = immutable dict, count = <*>, entries => <*> : Connection = <CFString <*> [<*>]>{contents = ""keep-alive""} <*> : Content-Type = text/html <*> : Content-Length = <*> <*> : Server = nginx <*> : Date = <CFString <*> [<*>]>{contents = ""<*> <*> <*>:<*>:<*> GMT""} } }]",Mac,O O O O O O O O,0,0,0,0,0,0,0,0,0,0
1588,Jul,7,00:01:59,calvisitor-10-105-162-178,kernel,0,,Sandbox: SpotlightNetHelp(352) deny(1) ipc-posix-shm-read-data CFPBS:186A7:,Mac_E298,Sandbox: <*>(<*>) deny(<*>) ipc-posix-shm-read-data CFPBS:<*>:,Mac,O O O O O OID O,1,0,0,0,0,0,0,0,0,0
1591,Jul,7,00:10:01,calvisitor-10-105-162-178,taskgated,273,,"no application identifier provided, can't use provisioning profiles [pid=37563]",Mac_E273,"no application identifier provided, can't use provisioning profiles [pid=<*>]",Mac,O O O O O O O O O,0,0,0,0,0,0,0,0,0,0
1592,Jul,7,00:12:09,calvisitor-10-105-162-178,SpotlightNetHelper,352,,tcp_connection_destination_handle_tls_close_notify 111 closing socket due to TLS CLOSE_NOTIFY alert,Mac_E315,tcp_connection_destination_handle_tls_close_notify <*> closing socket due to TLS CLOSE_NOTIFY alert,Mac,O O O O O O O O O O STC O O O O O O O O O O O O O O,0,0,0,0,0,0,0,0,1,0
1593,Jul,7,00:24:41,calvisitor-10-105-162-178,com.apple.WebKit.Networking,9854,,CFNetwork SSLHandshake failed (-9802),Mac_E182,CFNetwork SSLHandshake failed (<*>),Mac,O O O O O O O O O O O,0,0,0,0,0,0,0,0,0,0
