LineId,Month,Date,Time,User,Component,PID,Address,Content,EventId,EventTemplate,System,VariableTemplate,OID,LOI,OBN,TID,SID,TDA,CRS,OBA,STC,OTP
190,Jul,1,20:23:09,calvisitor-10-105-163-202,cloudd,326,,"SecOSStatusWith error:[-50] Error Domain=NSOSStatusErrorDomain Code=-50 ""query missing class name"" (paramErr: error in user parameter list) UserInfo={NSDescription=query missing class name}",Mac_E303,"SecOSStatusWith error:[<*>] Error Domain=NSOSStatusErrorDomain Code=<*> ""query missing class name"" (paramErr: error in user parameter list) UserInfo={NSDescription=query missing class name}",Mac,O O O O O O O O O O O O,0,0,0,0,0,0,0,0,0,0
191,Jul,1,21:03:00,calvisitor-10-105-163-202,WindowServer,184,,send_datagram_available_ping: pid 445 failed to act on a ping it dequeued before timing out.,Mac_E305,send_datagram_available_ping: pid <*> failed to act on a ping it dequeued before timing out.,Mac,O O O O O O O O O O O O,0,0,0,0,0,0,0,0,0,0
192,Jul,1,21:10:19,calvisitor-10-105-163-202,Preview,11512,,WARNING: Type1 font data isn't in the correct format required by the Adobe Type 1 Font Format specification.,Mac_E341,WARNING: Type1 font data isn't in the correct format required by the Adobe Type <*> Font Format specification.,Mac,O O O O O O LOI O O O O O O O O O O O O O O TDA O,0,1,0,0,0,1,0,0,0,0
201,Jul,1,22:08:16,calvisitor-10-105-163-202,WindowServer,184,,"device_generate_desktop_screenshot: authw 0x7fa823c89600(2000), shield 0x7fa8258cac00(2001)",Mac_E199,"device_generate_desktop_screenshot: authw <*>(<*>), shield <*>(<*>)",Mac,O O O O O O O O OID OID OID OID OBA,4,0,0,0,0,0,0,1,0,0
208,Jul,1,22:22:59,calvisitor-10-105-163-202,CalendarAgent,279,,[com.apple.calendar.store.log.caldav.coredav] [Refusing to parse response to PROPPATCH because of content-type: [text/html; charset=UTF-8].],Mac_E28,[com.apple.calendar.store.log.caldav.coredav] [Refusing to parse response to PROPPATCH because of content-type: [text/html; charset=UTF-<*>].],Mac,O O O O O O OID O O O OBA O OBA O OBA,1,0,0,0,0,0,0,3,0,0
209,Jul,1,22:25:38,calvisitor-10-105-163-202,locationd,82,,"NETWORK: requery, 0, 0, 0, 0, 250, items, fQueryRetries, 0, fLastRetryTimestamp, 520665636.6",Mac_E271,"NETWORK: requery, <*>, <*>, <*>, <*>, <*>, items, fQueryRetries, <*>, fLastRetryTimestamp, <*>",Mac,O O O O O O O O O O O O O O O O O,0,0,0,0,0,0,0,0,0,0
212,Jul,1,23:32:34,calvisitor-10-105-163-202,kernel,0,,Previous sleep cause: 5,Mac_E293,Previous sleep cause: <*>,Mac,O O O O O O O O O O O O O,0,0,0,0,0,0,0,0,0,0
214,Jul,1,23:46:06,calvisitor-10-105-163-202,kernel,0,,Wake reason: RTC (Alarm),Mac_E338,Wake reason: RTC (Alarm),Mac,O O O O O LOI O O O OBA,0,1,0,0,0,0,0,1,0,0
215,Jul,1,23:46:06,calvisitor-10-105-163-202,kernel,0,,AppleThunderboltNHIType2::prePCIWake - power up complete - took 2 us,Mac_E57,<*>::prePCIWake - power up complete - took <*> us,Mac,O O O O O O O O O O OID O O O O O O O O,1,0,0,0,0,0,0,0,0,0
218,Jul,2,02:18:39,calvisitor-10-105-163-202,configd,53,,network changed: v4(en0-:10.105.163.202) v6(en0:2607:f140:6000:8:c6b3:1ff:fecd:467f) DNS! Proxy SMB,Mac_E267,network changed: <*>(<*>:<*>) <*>(<*>) DNS! Proxy SMB,Mac,O O O O O O O O O O SID,0,0,0,0,1,0,0,0,0,0
220,Jul,2,02:32:17,calvisitor-10-105-163-202,kernel,0,,hibernate_page_list_setall found pageCount 448015,Mac_E233,hibernate_page_list_setall found pageCount <*>,Mac,O O O O O OID LOI O O O,1,1,0,0,0,0,0,0,0,0
221,Jul,2,02:32:17,calvisitor-10-105-163-202,kernel,0,,[HID] [ATC] [Error] AppleDeviceManagementHIDEventService::start Could not make a string from out connection notification key,Mac_E32,[HID] [ATC] [Error] AppleDeviceManagementHIDEventService::start Could not make a string from out connection notification key,Mac,O O O O O O OID O O O O LOI,1,1,0,0,0,0,0,0,0,0
223,Jul,2,02:32:17,calvisitor-10-105-163-202,kernel,0,,[IOBluetoothFamily][staticBluetoothTransportShowsUp] -- Received Bluetooth Controller register service notification -- 0x7000,Mac_E38,[IOBluetoothFamily][staticBluetoothTransportShowsUp] -- Received Bluetooth Controller register service notification -- <*>,Mac,O O O O O O LOI O O O O O O O O O O O O O O TDA O,0,1,0,0,0,1,0,0,0,0
227,Jul,2,10:40:07,calvisitor-10-105-163-202,GoogleSoftwareUpdateAgent,32012,,"2017-07-02 10:40:07.676 GoogleSoftwareUpdateAgent[32012/0x7000002a0000] [lvl=2] -[KSAgentApp updateProductWithProductID:usingEngine:] Checking for updates for ""com.google.Keystone"" using engine <KSUpdateEngine:0x100313e70 ticketStore=<KSPersistentTicketStore:0x100332a60 store=<KSKeyedPersistentStore:0x100315fa0 path=""/Users/xpc/Library/Google/GoogleSoftwareUpdate/TicketStore/Keystone.ticketstore"" lockFile=<KSLockFile:0x1003176d0 path=""/Users/xpc/Library/Google/GoogleSoftwareUpdate/TicketStore/Keystone.ticketstore.lock"" locked=NO > >> processor=<KSActionProcessor:0x1003143e0 delegate=<KSUpdateEngine:0x100313e70> isProcessing=NO actionsCompleted=0 progress=0.00 errors=0 currentActionErrors=0 events=0 currentActionEvents=0 actionQueue=( ) > delegate=(null) serverInfoStore=<KSServerPrivateInfoStore:0x100311a10 path=""/Users/xpc/Library/Google/GoogleSoftwareUpdate/Servers""> errors=0 >",Mac_E77,"<*>-<*>-<*> <*>:<*>:<*> GoogleSoftwareUpdateAgent[<*>/<*>] [lvl=<*>] -[KSAgentApp updateProductWithProductID:usingEngine:] Checking for updates for ""com.google.Keystone"" using engine <KSUpdateEngine:<*> ticketStore=<KSPersistentTicketStore:<*> store=<KSKeyedPersistentStore:<*> path=""<*>"" lockFile=<KSLockFile:<*> path=""<*>"" locked=NO > >> processor=<KSActionProcessor:<*> delegate=<KSUpdateEngine:<*> isProcessing=NO actionsCompleted=<*> progress=<*> errors=<*> currentActionErrors=<*> events=<*> currentActionEvents=<*> actionQueue=( ) > delegate=(<*>) serverInfoStore=<KSServerPrivateInfoStore:<*> path=""<*>""> errors=<*> >",Mac,O O O O O O OID O O O O O O O O O TDA,1,0,0,0,0,1,0,0,0,0
228,Jul,2,11:38:49,calvisitor-10-105-163-202,QQ,10018,,2017/07/02 11:38:49.414 | I | VoipWrapper  | DAVEngineImpl.cpp:1400:Close             | close video chat. llFriendUIN = ******2341.,Mac_E53,<*>/<*>/<*> <*>:<*>:<*> | I | VoipWrapper | DAVEngineImpl.cpp:<*>:Close | close video chat. llFriendUIN = <*>.,Mac,O O O O O OID OBN O O O O O OBN OID LOI,2,1,2,0,0,0,0,0,0,0
229,Jul,2,11:39:07,calvisitor-10-105-163-202,kernel,0,,"ARPT: 645791.413780: IOPMPowerSource Information: onSleep,  SleepType: Normal Sleep,  'ExternalConnected': No, 'TimeRemaining': 156,",Mac_E134,"ARPT: <*>: IOPMPowerSource Information: onSleep, SleepType: Normal Sleep, 'ExternalConnected': No, 'TimeRemaining': <*>,",Mac,O O O O O O OID O O O OTP O OTP O O CRS,1,0,0,0,0,0,1,0,0,2
234,Jul,2,12:15:23,calvisitor-10-105-163-202,kernel,0,,Bluetooth -- LE is supported - Disable LE meta event,Mac_E157,Bluetooth -- LE is supported - Disable LE meta event,Mac,O O O O O O O O O,0,0,0,0,0,0,0,0,0,0
235,Jul,2,12:15:23,calvisitor-10-105-163-202,sharingd,30299,,12:15:23.005 : Discoverable mode changed to Off,Mac_E67,<*>:<*>:<*> : Discoverable mode changed to Off,Mac,O O O O O O O O O O O O O,0,0,0,0,0,0,0,0,0,0
236,Jul,2,12:15:24,authorMacBook-Pro,QQ,10018,,tcp_connection_handle_connect_conditions_bad 19617 failed: 3 - No network route,Mac_E318,tcp_connection_handle_connect_conditions_bad <*> failed: <*> - No network route,Mac,O O O O O O O O,0,0,0,0,0,0,0,0,0,0
237,Jul,2,12:15:30,authorMacBook-Pro,UserEventAgent,43,,Captive: CNPluginHandler en0: Authenticated,Mac_E163,Captive: CNPluginHandler en0: Authenticated,Mac,O O O O O O O O O O O O O O O O O O O O,0,0,0,0,0,0,0,0,0,0
238,Jul,2,12:29:56,calvisitor-10-105-163-202,kernel,0,,ARPT: 645957.322055: wl0: setup_keepalive: Local IP: 10.105.163.202,Mac_E145,ARPT: <*>: wl0: setup_keepalive: Local IP: <*>,Mac,O O O O O LOI O O O LOI O LOI,0,3,0,0,0,0,0,0,0,0
248,Jul,2,13:05:38,calvisitor-10-105-163-202,kernel,0,,TBT W (2): 0x0040 [x],Mac_E314,TBT W (<*>): <*> [x],Mac,O O O O O O OID O O O O LOI,1,1,0,0,0,0,0,0,0,0
249,Jul,2,13:05:40,authorMacBook-Pro,configd,53,,network changed: DNS* Proxy,Mac_E269,network changed: DNS* Proxy,Mac,O O O O O OID O,1,0,0,0,0,0,0,0,0,0
255,Jul,2,13:13:22,authorMacBook-Pro,mDNSResponder,91,,mDNS_RegisterInterface: Frequent transitions for interface awdl0 (FE80:0000:0000:0000:D8A5:90FF:FEF5:7FFF),Mac_E262,mDNS_RegisterInterface: Frequent transitions for interface awdl0 (<*>),Mac,O O O O O LOI O O O O O STC O STC,0,1,0,0,0,0,0,0,2,0
266,Jul,2,15:06:24,calvisitor-10-105-163-202,syslogd,44,,ASL Sender Statistics,Mac_E153,ASL Sender Statistics,Mac,O O O O O O O OBA OBA OBA OBA OBA O O OBA O TDA,0,0,0,0,0,1,0,6,0,0
269,Jul,2,15:46:40,calvisitor-10-105-163-202,GoogleSoftwareUpdateAgent,32432,,2017-07-02 15:46:40.516 GoogleSoftwareUpdateAgent[32432/0x7000002a0000] [lvl=2] -[KSOutOfProcessFetcher(PrivateMethods) launchedHelperTaskForToolPath:error:] KSOutOfProcessFetcher launched '/Users/xpc/Library/Google/GoogleSoftwareUpdate/GoogleSoftwareUpdate.bundle/Contents/MacOS/ksfetch' with process id: 32433,Mac_E86,<*>-<*>-<*> <*>:<*>:<*> GoogleSoftwareUpdateAgent[<*>/<*>] [lvl=<*>] -[KSOutOfProcessFetcher(PrivateMethods) launchedHelperTaskForToolPath:error:] KSOutOfProcessFetcher launched '<*>' with process id: <*>,Mac,O O O O O O O O OBN,0,0,1,0,0,0,0,0,0,0
270,Jul,2,15:46:40,calvisitor-10-105-163-202,GoogleSoftwareUpdateAgent,32432,,"2017-07-02 15:46:40.697 GoogleSoftwareUpdateAgent[32432/0x7000002a0000] [lvl=2] -[KSUpdateEngine updateAllExceptProduct:] KSUpdateEngine updating all installed products, except:'com.google.Keystone'.",Mac_E90,"<*>-<*>-<*> <*>:<*>:<*> GoogleSoftwareUpdateAgent[<*>/<*>] [lvl=<*>] -[KSUpdateEngine updateAllExceptProduct:] KSUpdateEngine updating all installed products, except:'com.google.Keystone'.",Mac,O O O O O O O O,0,0,0,0,0,0,0,0,0,0
271,Jul,2,15:46:41,calvisitor-10-105-163-202,ksfetch,32435,,2017-07-02 15:46:41.445 ksfetch[32435/0x7fff79824000] [lvl=2] main() ksfetch fetching URL (<NSMutableURLRequest: 0x1005110b0> { URL: https://tools.google.com/service/update2?cup2hreq=53f725cf03f511fab16f19e789ce64aa1eed72395fc246e9f1100748325002f4&cup2key=7:1132320327 }) to folder:/tmp/KSOutOfProcessFetcher.YH2CjY1tnx/download,Mac_E96,<*>-<*>-<*> <*>:<*>:<*> ksfetch[<*>/<*>] [lvl=<*>] main() ksfetch fetching URL (<NSMutableURLRequest: <*> { URL: <*> }) to folder:<*>,Mac,O O O O O O OID O,1,0,0,0,0,0,0,0,0,0
274,Jul,2,16:55:53,calvisitor-10-105-163-202,com.apple.xpc.launchd,1,com.apple.xpc.launchd.domain.pid.WebContent.32502,"Path not allowed in target domain: type = pid, path = /System/Library/StagedFrameworks/Safari/SafariShared.framework/Versions/A/XPCServices/com.apple.Safari.SearchHelper.xpc/Contents/MacOS/com.apple.Safari.SearchHelper error = 147: The specified service did not ship in the requestor's bundle, origin = /System/Library/StagedFrameworks/Safari/WebKit.framework/Versions/A/XPCServices/com.apple.WebKit.WebContent.xpc",Mac_E283,"Path not allowed in target domain: type = pid, path = <*> error = <*>: The specified service did not ship in the requestor's bundle, origin = <*>",Mac,O O O O O O O O O LOI,0,1,0,0,0,0,0,0,0,0
278,Jul,2,17:13:46,calvisitor-10-105-163-202,com.apple.WebKit.WebContent,32514,,[17:13:46.390] <<<< IQ-CA >>>> piqca_setUsePreQueue: (0x7f92413e3000) rejecting report of layer being serviced - IQ has not yet begun to update,Mac_E16,[<*>:<*>:<*>] <<<< IQ-CA >>>> piqca_setUsePreQueue: (<*>) rejecting report of layer being serviced - IQ has not yet begun to update,Mac,O O O O O O O O O TID,0,0,0,1,0,0,0,0,0,0
279,Jul,2,17:19:15,calvisitor-10-105-163-202,com.apple.WebKit.WebContent,32514,,[17:19:15.148] itemasync_SetProperty signalled err=-12785 (kFigBaseObjectError_Invalidated) (invalidated) at /Library/Caches/com.apple.xbs/Sources/CoreMedia/CoreMedia-1731.15.207/Prototypes/Player/FigPlayer_Async.c line 2306,Mac_E19,[<*>:<*>:<*>] itemasync_SetProperty signalled err=<*> (kFigBaseObjectError_Invalidated) (invalidated) at <*> line <*>,Mac,O O O O O O O O O O O O O O O O,0,0,0,0,0,0,0,0,0,0
280,Jul,2,17:34:21,calvisitor-10-105-163-202,Safari,9852,,KeychainGetICDPStatus: keychain: -25300,Mac_E256,KeychainGetICDPStatus: keychain: <*>,Mac,O O O O O O O O O O TDA O,0,0,0,0,0,1,0,0,0,0
284,Jul,2,17:56:40,calvisitor-10-105-163-202,com.apple.ncplugin.WorldClock,32583,,host connection <NSXPCConnection: 0x7fddbbb015c0> connection from pid 30298 invalidated,Mac_E243,host connection <NSXPCConnection: <*> connection from pid <*> invalidated,Mac,O O O O O O O,0,0,0,0,0,0,0,0,0,0
285,Jul,2,17:56:40,calvisitor-10-105-163-202,com.apple.ncplugin.weather,32585,,Error in CoreDragRemoveReceiveHandler: -1856,Mac_E212,Error in CoreDragRemoveReceiveHandler: <*>,Mac,O O O O O O O,0,0,0,0,0,0,0,0,0,0
286,Jul,2,18:08:55,calvisitor-10-105-163-202,kernel,0,,ARPT: 661549.802297: wl0: leaveModulePoweredForOffloads: Wi-Fi will stay on.,Mac_E139,ARPT: <*>: wl0: leaveModulePoweredForOffloads: Wi-Fi will stay on.,Mac,O O O O O O O O O O TDA O,0,0,0,0,0,1,0,0,0,0
288,Jul,2,18:08:56,authorMacBook-Pro,kernel,0,,"ARPT: 661552.832561: IOPMPowerSource Information: onWake,  SleepType: Normal Sleep,  'ExternalConnected': Yes, 'TimeRemaining': 0,",Mac_E138,"ARPT: <*>: IOPMPowerSource Information: onWake, SleepType: Normal Sleep, 'ExternalConnected': Yes, 'TimeRemaining': <*>,",Mac,O O O O O O OID OID O LOI,2,1,0,0,0,0,0,0,0,0
300,Jul,2,18:38:31,authorMacBook-Pro,UserEventAgent,43,,Captive: CNPluginHandler en0: Inactive,Mac_E165,Captive: CNPluginHandler en0: Inactive,Mac,O O O O O O OID O O LOI O STC O O O,1,1,0,0,0,0,0,0,1,0
304,Jul,2,18:40:01,authorMacBook-Pro,kernel,0,,in6_unlink_ifa: IPv6 address 0x77c9114551ab23ab has no prefix,Mac_E75,<*>: IPv6 address <*> has no prefix,Mac,O O O O O O O O O O OID O O O O O O O O,1,0,0,0,0,0,0,0,0,0
316,Jul,2,19:34:33,calvisitor-10-105-163-202,com.apple.geod,30311,,"PBRequester failed with Error Error Domain=NSURLErrorDomain Code=-1001 ""The request timed out."" UserInfo={NSUnderlyingError=0x7fe133460660 {Error Domain=kCFErrorDomainCFNetwork Code=-1001 ""The request timed out."" UserInfo={NSErrorFailingURLStringKey=https://gsp-ssl.ls.apple.com/dispatcher.arpc, NSErrorFailingURLKey=https://gsp-ssl.ls.apple.com/dispatcher.arpc, _kCFStreamErrorCodeKey=-2102, _kCFStreamErrorDomainKey=4, NSLocalizedDescription=The request timed out.}}, NSErrorFailingURLStringKey=https://gsp-ssl.ls.apple.com/dispatcher.arpc, NSErrorFailingURLKey=https://gsp-ssl.ls.apple.com/dispatcher.arpc, _kCFStreamErrorDomainKey=4, _kCFStreamErrorCodeKey=-2102, NSLocalizedDescription=The request timed out.}",Mac_E286,"PBRequester failed with Error Error Domain=NSURLErrorDomain Code=<*> ""The request timed out."" UserInfo={NSUnderlyingError=<*> {Error Domain=kCFErrorDomainCFNetwork Code=<*> ""The request timed out."" UserInfo={NSErrorFailingURLStringKey=<*>, NSErrorFailingURLKey=<*>, _kCFStreamErrorCodeKey=<*>, _kCFStreamErrorDomainKey=<*>, NSLocalizedDescription=The request timed out.}}, NSErrorFailingURLStringKey=<*>, NSErrorFailingURLKey=<*>, _kCFStreamErrorDomainKey=<*>, _kCFStreamErrorCodeKey=<*>, NSLocalizedDescription=The request timed out.}",Mac,O O O O O O O O O O,0,0,0,0,0,0,0,0,0,0
329,Jul,2,20:22:38,calvisitor-10-105-163-202,WindowServer,184,,"device_generate_lock_screen_screenshot: authw 0x7fa823962400(2000)[0, 0, 1440, 900] shield 0x7fa82d372000(2001), dev [1440,900]",Mac_E200,"device_generate_lock_screen_screenshot: authw <*>(<*>)[<*>, <*>, <*>, <*>] shield <*>(<*>), dev [<*>,<*>]",Mac,O O O O O O O O O O O O O,0,0,0,0,0,0,0,0,0,0
331,Jul,2,20:50:47,calvisitor-10-105-163-202,ksfetch,32776,,2017-07-02 20:50:47.457 ksfetch[32776/0x7fff79824000] [lvl=2] KSHelperReceiveAllData() KSHelperTool read 1926 bytes from stdin.,Mac_E92,<*>-<*>-<*> <*>:<*>:<*> ksfetch[<*>/<*>] [lvl=<*>] KSHelperReceiveAllData() KSHelperTool read <*> bytes from stdin.,Mac,O O O O O O O LOI O CRS O OBA O CRS O OBA,0,1,0,0,0,0,2,2,0,0
332,Jul,2,21:17:07,calvisitor-10-105-163-202,com.apple.WebKit.WebContent,32778,,[21:17:07.529] FigAgglomeratorSetObjectForKey signalled err=-16020 (kFigStringConformerError_ParamErr) (NULL key) at /Library/Caches/com.apple.xbs/Sources/CoreMedia/CoreMedia-1731.15.207/Prototypes/LegibleOutput/FigAgglomerator.c line 92,Mac_E17,[<*>:<*>:<*>] FigAgglomeratorSetObjectForKey signalled err=<*> (kFigStringConformerError_ParamErr) (<*> key) at <*> line <*>,Mac,O O O O O O O O STC O O O STC,0,0,0,0,0,0,0,0,2,0
336,Jul,2,21:48:53,calvisitor-10-105-163-202,sharingd,30299,,21:48:53.041 : BTLE scanner Powered Off,Mac_E63,<*>:<*>:<*> : BTLE scanner Powered Off,Mac,O O O O O O O,0,0,0,0,0,0,0,0,0,0
338,Jul,2,22:24:03,authorMacBook-Pro,com.apple.geod,30311,,"PBRequester failed with Error Error Domain=NSURLErrorDomain Code=-1009 ""The Internet connection appears to be offline."" UserInfo={NSUnderlyingError=0x7fe13512cf70 {Error Domain=kCFErrorDomainCFNetwork Code=-1009 ""The Internet connection appears to be offline."" UserInfo={NSErrorFailingURLStringKey=https://gsp-ssl.ls.apple.com/dispatcher.arpc, NSErrorFailingURLKey=https://gsp-ssl.ls.apple.com/dispatcher.arpc, _kCFStreamErrorCodeKey=8, _kCFStreamErrorDomainKey=12, NSLocalizedDescription=The Internet connection appears to be offline.}}, NSErrorFailingURLStringKey=https://gsp-ssl.ls.apple.com/dispatcher.arpc, NSErrorFailingURLKey=https://gsp-ssl.ls.apple.com/dispatcher.arpc, _kCFStreamErrorDomainKey=12, _kCFStreamErrorCodeKey=8, NSLocalizedDescription=The Internet connection appears to be offline.}",Mac_E285,"PBRequester failed with Error Error Domain=NSURLErrorDomain Code=<*> ""The Internet connection appears to be offline."" UserInfo={NSUnderlyingError=<*> {Error Domain=kCFErrorDomainCFNetwork Code=<*> ""The Internet connection appears to be offline."" UserInfo={NSErrorFailingURLStringKey=<*>, NSErrorFailingURLKey=<*>, _kCFStreamErrorCodeKey=<*>, _kCFStreamErrorDomainKey=<*>, NSLocalizedDescription=The Internet connection appears to be offline.}}, NSErrorFailingURLStringKey=<*>, NSErrorFailingURLKey=<*>, _kCFStreamErrorDomainKey=<*>, _kCFStreamErrorCodeKey=<*>, NSLocalizedDescription=The Internet connection appears to be offline.}",Mac,O O O O O O LOI O O O O O O O O O O O O O O TDA O,0,1,0,0,0,1,0,0,0,0
339,Jul,2,22:24:03,authorMacBook-Pro,kernel,0,,ARPT: 669592.164786: AQM agg params 0xfc0 maxlen hi/lo 0x0 0xffff minlen 0x0 adjlen 0x0,Mac_E129,ARPT: <*>: AQM agg params <*> maxlen hi/lo <*> <*> minlen <*> adjlen <*>,Mac,O O O O O OID LOI O O O,1,1,0,0,0,0,0,0,0,0
340,Jul,2,22:24:04,authorMacBook-Pro,corecaptured,32877,,Received Capture Event,Mac_E294,Received Capture Event,Mac,O O O O O O O O O O O OBA,0,0,0,0,0,0,0,1,0,0
342,Jul,2,22:24:15,authorMacBook-Pro,kernel,0,,Sandbox: QQ(10018) deny(1) mach-lookup com.apple.networking.captivenetworksupport,Mac_E299,Sandbox: <*>(<*>) deny(<*>) mach-lookup <*>,Mac,O O O O O O O O O O,0,0,0,0,0,0,0,0,0,0
346,Jul,2,22:32:34,authorMacBook-Pro,com.apple.WebKit.WebContent,32778,,[22:32:34.846] <<<< Boss >>>> figPlaybackBossPrerollCompleted: unexpected preroll-complete notification,Mac_E12,[<*>:<*>:<*>] <<<< Boss >>>> figPlaybackBossPrerollCompleted: unexpected preroll-complete notification,Mac,O O O O O O O O O O,0,0,0,0,0,0,0,0,0,0
360,Jul,3,00:27:35,authorMacBook-Pro,ntpd,207,,sigio_handler: sigio_handler_active != 0,Mac_E312,sigio_handler: sigio_handler_active != <*>,Mac,O O O O O OID OID O O O,2,0,0,0,0,0,0,0,0,0
361,Jul,3,00:27:54,authorMacBook-Pro,QQ,10018,,############################## _getSysMsgList,Mac_E1,############################## _getSysMsgList,Mac,O O O O O O O O O,0,0,0,0,0,0,0,0,0,0
362,Jul,3,00:41:11,authorMacBook-Pro,syslogd,44,,"Configuration Notice: ASL Module ""com.apple.performance"" claims selected messages. Those messages may not appear in standard system log files or in the ASL database.",Mac_E190,"Configuration Notice: ASL Module ""<*>"" claims selected messages. Those messages may not appear in standard system log files or in the ASL database.",Mac,O O O O O O LOI O O O O O O O O O O O O O O TDA O,0,1,0,0,0,1,0,0,0,0
364,Jul,3,01:06:37,authorMacBook-Pro,kernel,0,,Wake reason: ?,Mac_E335,Wake reason: ?,Mac,O O O O O O O O O O O OBA,0,0,0,0,0,0,0,1,0,0
366,Jul,3,01:06:37,authorMacBook-Pro,sharingd,30299,,01:06:37.436 : Scanning mode Contacts Only,Mac_E70,<*>:<*>:<*> : Scanning mode Contacts Only,Mac,O O O O O O O,0,0,0,0,0,0,0,0,0,0
371,Jul,3,01:42:26,authorMacBook-Pro,sharingd,30299,,01:42:26.004 : BTLE scanning stopped,Mac_E66,<*>:<*>:<*> : BTLE scanning stopped,Mac,O O O O O O O O O,0,0,0,0,0,0,0,0,0,0
373,Jul,3,01:58:00,authorMacBook-Pro,ntpd,207,,wake time set +0.270003 s,Mac_E339,wake time set <*> s,Mac,O O O O O LOI O O O O O O OID O O,1,1,0,0,0,0,0,0,0,0
376,Jul,3,02:07:59,authorMacBook-Pro,hidd,98,,[HID] [MT] MTActuatorManagement::getActuatorRef Calling MTActuatorOpen() outside of MTTrackpadHIDManager.,Mac_E37,[HID] [MT] MTActuatorManagement::getActuatorRef Calling MTActuatorOpen() outside of MTTrackpadHIDManager.,Mac,O O O O O O OID O STC O O O O,1,0,0,0,0,0,0,0,1,0
405,Jul,3,05:31:03,authorMacBook-Pro,kernel,0,,AppleCamIn::handleWakeEvent_gated,Mac_E119,AppleCamIn::handleWakeEvent_gated,Mac,O O O O O O O O O O O LOI O O LOI,0,2,0,0,0,0,0,0,0,0
422,Jul,3,06:57:52,authorMacBook-Pro,sharingd,30299,,06:57:52.002 : Purged contact hashes,Mac_E69,<*>:<*>:<*> : Purged contact hashes,Mac,O O O O O OID O O O O O O O O O,1,0,0,0,0,0,0,0,0,0
429,Jul,3,07:33:34,authorMacBook-Pro,sharingd,30299,,07:33:34.878 : BTLE scanning started,Mac_E65,<*>:<*>:<*> : BTLE scanning started,Mac,O O O O O O,0,0,0,0,0,0,0,0,0,0
431,Jul,3,07:33:35,authorMacBook-Pro,kernel,0,,"IOPMrootDomain: idle cancel, state 1",Mac_E250,"IOPMrootDomain: idle cancel, state <*>",Mac,O O O O O O O O,0,0,0,0,0,0,0,0,0,0
441,Jul,3,08:45:12,authorMacBook-Pro,kernel,0,,ARPT: 673325.798753: ARPT: Wake Reason: Wake on TCP Timeout,Mac_E132,ARPT: <*>: ARPT: Wake Reason: Wake on TCP Timeout,Mac,O O O O O O LOI O O O O O O O O O O O O O O TDA O,0,1,0,0,0,1,0,0,0,0
447,Jul,3,09:21:24,authorMacBook-Pro,kernel,0,,"hibernate_alloc_pages act 173850, inact 24957, anon 891, throt 0, spec 73492, wire 527143, wireinit 39927",Mac_E227,"hibernate_alloc_pages act <*>, inact <*>, anon <*>, throt <*>, spec <*>, wire <*>, wireinit <*>",Mac,O O O O O LOI O O O O O,0,1,0,0,0,0,0,0,0,0
448,Jul,3,09:21:24,authorMacBook-Pro,kernel,0,,hibernate_teardown_pmap_structs done: last_valid_compact_indx 282563,Mac_E242,hibernate_teardown_pmap_structs done: last_valid_compact_indx <*>,Mac,O O O O O O O O O,0,0,0,0,0,0,0,0,0,0
459,Jul,3,10:28:07,authorMacBook-Pro,pkd,324,,enabling pid=30298 for plug-in com.apple.ncplugin.weather(1.0) 131FE7ED-87F7-471D-8797-C11107688DF7 /System/Library/CoreServices/Weather.app/Contents/PlugIns/com.apple.ncplugin.weather.appex,Mac_E211,enabling pid=<*> for plug-in com.apple.ncplugin.weather(<*>) <*>-<*>-<*>-<*>-<*> <*>,Mac,O O O O O LOI O O O O O O O,0,1,0,0,0,0,0,0,0,0
461,Jul,3,10:40:41,authorMacBook-Pro,GoogleSoftwareUpdateAgent,33263,,"2017-07-03 10:40:41.730 GoogleSoftwareUpdateAgent[33263/0x700000323000] [lvl=2] -[KSAgentApp performSelfUpdateWithEngine:] Checking for self update with Engine: <KSUpdateEngine:0x10062de70 ticketStore=<KSPersistentTicketStore:0x1005206e0 store=<KSKeyedPersistentStore:0x1005282c0 path=""/Users/xpc/Library/Google/GoogleSoftwareUpdate/TicketStore/Keystone.ticketstore"" lockFile=<KSLockFile:0x100510480 path=""/Users/xpc/Library/Google/GoogleSoftwareUpdate/TicketStore/Keystone.ticketstore.lock"" locked=NO > >> processor=<KSActionProcessor:0x10062e060 delegate=<KSUpdateEngine:0x10062de70> isProcessing=NO actionsCompleted=0 progress=0.00 errors=0 currentActionErrors=0 events=0 currentActionEvents=0 actionQueue=( ) > delegate=(null) serverInfoStore=<KSServerPrivateInfoStore:0x10062d2d0 path=""/Users/xpc/Library/Google/GoogleSoftwareUpdate/Servers""> errors=0 >",Mac_E76,<*>-<*>-<*> <*>:<*>:<*> GoogleSoftwareUpdateAgent[<*>/<*>] [lvl=<*>] -[KSAgentApp performSelfUpdateWithEngine:] Checking for self update with Engine: <KSUpdateEngine:<*> ticketStore=<KSPersistentTicketStore:<*> store=<KSKeyedPersistentStore:<*> path=<*> lockFile=<KSLockFile:<*> path=<*> locked=NO > >> processor=<KSActionProcessor:<*> delegate=<KSUpdateEngine:<*> isProcessing=NO actionsCompleted=<*> progress=<*> errors=<*> currentActionErrors=<*> events=<*> currentActionEvents=<*> actionQueue=( ) > delegate=(<*>) serverInfoStore=<KSServerPrivateInfoStore:<*> path=<*> errors=<*> >,Mac,O O O O O O O O O O O OBA,0,0,0,0,0,0,0,1,0,0
462,Jul,3,10:40:42,authorMacBook-Pro,GoogleSoftwareUpdateAgent,33263,,2017-07-03 10:40:42.940 GoogleSoftwareUpdateAgent[33263/0x700000323000] [lvl=2] -[KSOmahaServer updateInfosForUpdateResponse:updateRequest:infoStore:upToDateTickets:updatedTickets:events:errors:] Response passed CUP validation.,Mac_E82,<*>-<*>-<*> <*>:<*>:<*> GoogleSoftwareUpdateAgent[<*>/<*>] [lvl=<*>] -[KSOmahaServer updateInfosForUpdateResponse:updateRequest:infoStore:upToDateTickets:updatedTickets:events:errors:] Response passed CUP validation.,Mac,O O O O O O O O O,0,0,0,0,0,0,0,0,0,0
466,Jul,3,11:31:49,authorMacBook-Pro,com.apple.WebKit.WebContent,32778,,[11:31:49.593] itemasync_CopyProperty signalled err=-12785 (kFigBaseObjectError_Invalidated) (invalidated) at /Library/Caches/com.apple.xbs/Sources/CoreMedia/CoreMedia-1731.15.207/Prototypes/Player/FigPlayer_Async.c line 2092,Mac_E18,[<*>:<*>:<*>] itemasync_CopyProperty signalled err=<*> (kFigBaseObjectError_Invalidated) (invalidated) at <*> line <*>,Mac,O O O O O LOI O O O O O O O,0,1,0,0,0,0,0,0,0,0
484,Jul,3,12:31:55,authorMacBook-Pro,kernel,0,,"Opened file /var/log/SleepWakeStacks.bin, size 172032, extents 1, maxio 2000000 ssd 1",Mac_E280,"Opened file <*>, size <*>, extents <*>, maxio <*> ssd <*>",Mac,O O O O O O LOI O O O O O O O O O O O O O O TDA O,0,1,0,0,0,1,0,0,0,0
485,Jul,3,12:35:55,authorMacBook-Pro,locationd,82,,"NETWORK: no response from server, reachability, 2, queryRetries, 0",Mac_E270,"NETWORK: no response from server, reachability, <*>, queryRetries, <*>",Mac,O O O O O LOI O O STC O O O O LOI O LOI,0,3,0,0,0,0,0,0,1,0
